adult,belongs_to_collection,budget,genres,homepage,id,imdb_id,original_language,original_title,overview,popularity,poster_path,production_companies,production_countries,release_date,revenue,runtime,spoken_languages,status,tagline,title,video,vote_average,vote_count
False,,0,"[{'id': 27, 'name': 'Horror'}, {'id': 53, 'name': 'Thriller'}]",,34574,tt0110620,en,Nadja,"This ultra-hip, post-modern vampire tale is set in contemporary New York City. Members of a dysfunctional family of vampires are trying to come to terms with each other, in the wake of their father's death. Meanwhile, they are being hunted by Dr. Van Helsing and his hapless nephew. As in all good vampire movies, forces of love are pitted against forces of destruction.",7.720056,/bRz2J0jlMgczJptX0Atzo9l70Bd.jpg,"[{'name': 'Kino Link Company', 'id': 37897}]","[{'iso_3166_1': 'US', 'name': 'United States of America'}]",1994-09-13,0,93.0,"[{'iso_639_1': 'de', 'name': 'Deutsch'}, {'iso_639_1': 'en', 'name': 'English'}]",Released,Unseen. Unforgiving. Undead.,Nadja,False,5.9,12
False,"{'id': 328073, 'name': 'Síť (kolekce)', 'poster_path': '/k8HvmCUbKHBbTJoe7hJQapQd5Uy.jpg', 'backdrop_path': '/5j4HxayNgcAgGStNKqPxM0QNC7V.jpg'}",22000000,"[{'id': 80, 'name': 'Crime'}, {'id': 18, 'name': 'Drama'}, {'id': 9648, 'name': 'Mystery'}, {'id': 53, 'name': 'Thriller'}, {'id': 28, 'name': 'Action'}]",,1642,tt0113957,en,The Net,"Angela Bennett is a freelance software engineer who lives in a world of computer technology. When a cyber friend asks Bennett to debug a new game, she inadvertently becomes involved in a conspiracy that will soon turn her life upside down. While on vacation in Mexico, her purse is stolen. She soon finds that people and events may not be what they seem as she becomes the target of an assassination. Her vacation is ruined.  She gets a new passport at the U.S. Embassy in Mexico but it has the wrong name, Ruth Marx. When she returns to the U.S. to sort things out, she discovers that Ruth Marx has an unsavory past and a lengthy  police record. To make matters worse, another person has assumed her real identity ...",13.304342,/gKDNaAFzT21cSVeKQop7d1uhoSp.jpg,"[{'name': 'Columbia Pictures', 'id': 5}]","[{'iso_3166_1': 'US', 'name': 'United States of America'}]",1995-07-28,110627965,114.0,"[{'iso_639_1': 'en', 'name': 'English'}, {'iso_639_1': 'es', 'name': 'Español'}]",Released,"No driver's license, no credit cards, no passport, no access to her bank accounts in a foreign country ... She finds her identity stolen.",The Net,False,5.6,359
False,,0,"[{'id': 35, 'name': 'Comedy'}]",,11472,tt0113986,en,Nine Months,"When he finds out his longtime girlfriend is pregnant, a commitment-phobe realizes he might have to change his lifestyle for better or much, much worse.",8.482834,/aYavA2TOqpWVcxQZ31mMlYKqoFM.jpg,"[{'name': 'Twentieth Century Fox Film Corporation', 'id': 306}, {'name': '1492 Pictures', 'id': 436}]","[{'iso_3166_1': 'US', 'name': 'United States of America'}]",1995-07-12,69660733,103.0,"[{'iso_639_1': 'en', 'name': 'English'}, {'iso_639_1': 'ru', 'name': 'Pусский'}]",Released,Ready or Not.,Nine Months,False,5.5,171
False,,150000,"[{'id': 35, 'name': 'Comedy'}]",,36196,tt0114095,en,Party Girl,"Although Mary has little income, she still finds ways to spend her nights at clubs. After being arrested for throwing an illegal rave, she asks her aunt Judy for bail money. Judy then finds Mary a job at her library so that Mary can repay her. Initially, Mary finds the job as a clerk boring and stifling, and prefers to get to know a street food vendor whom she likes. However, Mary must refocus her life once she loses her job and apartment.",1.165039,/iYM0EdHrcbu8rhkDKVBkDcZEo8t.jpg,"[{'name': 'Party Productions', 'id': 37890}]","[{'iso_3166_1': 'US', 'name': 'United States of America'}]",1995-06-09,472370,94.0,"[{'iso_639_1': 'en', 'name': 'English'}]",Released,"Sassy, savvy and definitely clued-in!",Party Girl,False,5.8,14
False,"{'id': 9068, 'name': 'The Prophecy Collection', 'poster_path': '/pU4wvBeirFDNk8rs9tsGZLa7Kyb.jpg', 'backdrop_path': None}",8,"[{'id': 14, 'name': 'Fantasy'}, {'id': 27, 'name': 'Horror'}, {'id': 53, 'name': 'Thriller'}]",,11980,tt0114194,en,The Prophecy,"The angel Gabriel comes to Earth to collect a soul which will end the stalemated war in Heaven, and only a former priest and a little girl can stop him.",10.187623,/A3aYGp8LLxuFdzG2ETnhfbWPk7h.jpg,"[{'name': 'Dimension Films', 'id': 7405}]","[{'iso_3166_1': 'US', 'name': 'United States of America'}]",1995-09-01,16,98.0,"[{'iso_639_1': 'en', 'name': 'English'}]",Released,"On ancient ground, at the edge of the world, an evil born in heaven is about to be unleashed on earth.",The Prophecy,False,6.4,139
False,,0,"[{'id': 14, 'name': 'Fantasy'}, {'id': 35, 'name': 'Comedy'}, {'id': 18, 'name': 'Drama'}]",,58372,tt0114241,en,Reckless,"On Christmas eve, a relentlessly cheerful woman escapes from the killers hired by her husband, and embarks on a series of strange encounters.",0.119713,/mIEtFo5z8G6b0r2mxHjfIWT7vy7.jpg,"[{'name': 'Playhouse International Pictures', 'id': 2492}, {'name': 'American Playhouse', 'id': 3906}, {'name': 'Samuel Goldwyn Company, The', 'id': 28205}]","[{'iso_3166_1': 'US', 'name': 'United States of America'}]",1995-11-17,0,91.0,"[{'iso_639_1': 'en', 'name': 'English'}]",Released,The most twisted Christmas ever.,Reckless,False,10.0,1
False,,0,"[{'id': 18, 'name': 'Drama'}]",,32646,tt0114323,en,Safe,"Carol, a typical upper middle-class housewife, begins to complain of vague symptoms of illness. She ""doesn't feel right,"" has unexplained headaches, congestion, a dry cough, nosebleeds, vomiting, and trouble breathing. Her family doctor treats her concerns dismissively and suggests a psychiatrist. Eventually, an allergist tells her that she has Environmental Illness.",8.180047,/ihX2udk636JMAAaWDIMj6n5ejhb.jpg,"[{'name': 'Killer Films', 'id': 1422}, {'name': 'American Playhouse', 'id': 3906}, {'name': 'Kardana Films', 'id': 38692}, {'name': 'Chemical Films', 'id': 39861}]","[{'iso_3166_1': 'GB', 'name': 'United Kingdom'}, {'iso_3166_1': 'US', 'name': 'United States of America'}]",1995-06-23,0,119.0,"[{'iso_639_1': 'en', 'name': 'English'}]",Released,In the 21st century nobody will be... Safe.,Safe,False,7.2,62
False,,50000000,"[{'id': 18, 'name': 'Drama'}, {'id': 36, 'name': 'History'}, {'id': 10749, 'name': 'Romance'}]",,10533,tt0114345,en,The Scarlet Letter,"Set in puritanical Boston in the mid 1600s, the story of seamstress Hester Prynne, who is outcast after she becomes pregnant by a respected reverend. She refuses to divulge the name of the father, is ""convicted"" of adultery and forced to wear a scarlet ""A"" until an Indian attack unites the Puritans and leads to a reevaluation of their laws and morals.",6.752119,/g46rChf49Qgq28RJ22iWwvsK7nO.jpg,"[{'name': 'Hollywood Pictures', 'id': 915}, {'name': 'Cinergi Pictures Entertainment', 'id': 1504}]","[{'iso_3166_1': 'US', 'name': 'United States of America'}]",1995-10-13,10382407,135.0,"[{'iso_639_1': 'en', 'name': 'English'}]",Released,"When intimacy is forbidden and passion is a sin, love is the most defiant crime of all.",The Scarlet Letter,False,5.5,111
False,,0,"[{'id': 99, 'name': 'Documentary'}]",,56088,tt0114435,en,The Show,"A documentary about the culture of hip-hop. Through interviews with some of hip-hops biggest names, the film makers attempt to find out why it has become so popular.",0.159596,/qUlVaRYuiMvr1R3ZBW6hpS9QB4h.jpg,[],[],1995-08-25,0,93.0,[],,What Happens On Stage Is Only Half The Story!,The Show,False,5.3,2
False,"{'id': 247294, 'name': 'Showgirls Collection', 'poster_path': '/lXpCjeuKtzkckXkam8sgOaaTOhc.jpg', 'backdrop_path': '/nKMLBnDGCPdHipJs0Xk8NzNmLFS.jpg'}",45000000,"[{'id': 18, 'name': 'Drama'}]",,10802,tt0114436,en,Showgirls,A young drifter named Nomi arrives in Las Vegas to become a dancer and soon sets about clawing and pushing her way to become a top showgirl.,17.502375,/7O2SxrsXYaGFZ5cZgJF0Ab5SV5J.jpg,"[{'name': 'United Artists', 'id': 60}, {'name': 'Le Studio Canal+', 'id': 183}, {'name': 'Carolco Pictures', 'id': 14723}]","[{'iso_3166_1': 'FR', 'name': 'France'}, {'iso_3166_1': 'US', 'name': 'United States of America'}]",1995-09-22,20350754,128.0,"[{'iso_639_1': 'en', 'name': 'English'}]",Released,Beyond your wildest dreams. Beyond your wildest fantasies.,Showgirls,False,4.9,261
False,"{'id': 439053, 'name': 'Brooklyn Cigar Store Collection', 'poster_path': '/bgiPsYjbjbRFmEeUfYlp8ZDBVJJ.jpg', 'backdrop_path': '/r4Ov7P8OADcOxfpuDujoJl2Cqry.jpg'}",7000000,"[{'id': 35, 'name': 'Comedy'}, {'id': 18, 'name': 'Drama'}]",,10149,tt0114478,en,Smoke,"Writer Paul Benjamin is nearly hit by a bus when he leaves Auggie Wren's smoke shop. Stranger Rashid Cole  saves his life, and soon middle-aged Paul tells homeless Rashid that he wouldn't mind a short-term housemate. Still grieving over his wife's murder, Paul is moved by both Rashid's quest to reconnect with his father and Auggie's discovery that a woman who might be his daughter is about to give birth.",5.552946,/dku3aLprH3j1ilSsubW9Pbgfe0y.jpg,"[{'name': 'Miramax Films', 'id': 14}]","[{'iso_3166_1': 'DE', 'name': 'Germany'}, {'iso_3166_1': 'JP', 'name': 'Japan'}, {'iso_3166_1': 'US', 'name': 'United States of America'}]",1995-06-09,8349430,112.0,"[{'iso_639_1': 'en', 'name': 'English'}]",Released,Where there's smoke... there's laughter!,Smoke,False,7.2,115
False,,0,"[{'id': 35, 'name': 'Comedy'}]",,18402,tt0114496,en,Something to Talk About,"In one of her best-ever roles, Julia Roberts is Grace, whose reaction to the infidelities of Eddie (Dennis Quaid) turns the lives and loves of the people around her into something like falling dominoes. Robert Duvall, Gena Rowlands, Kyra Sedgwick and others in ""the year's best ensemble of characters"" (Jack Matthews, 'Newsday') co-star in this juicy, truthful story written by Callie Khouri",3.743212,/p9qioRaQblGXemFRQSwo8TpikVJ.jpg,"[{'name': 'Spring Creek Productions', 'id': 705}, {'name': 'Warner Bros.', 'id': 6194}, {'name': 'Hawn / Sylbert Movie Company', 'id': 16368}]","[{'iso_3166_1': 'US', 'name': 'United States of America'}]",1995-08-04,50892160,106.0,"[{'iso_639_1': 'en', 'name': 'English'}]",Released,"A story about husbands, wives, parents, children and other natural disasters.",Something to Talk About,False,5.7,60
False,"{'id': 9887, 'name': 'Species Collection', 'poster_path': '/t5J0JH1L8L7CmtC3sL3K2ybgTbE.jpg', 'backdrop_path': '/vnpcoCTZhg1EdEog1kAS0pklx1o.jpg'}",35000000,"[{'id': 878, 'name': 'Science Fiction'}, {'id': 27, 'name': 'Horror'}, {'id': 28, 'name': 'Action'}]",,9348,tt0114508,en,Species,"In 1993, the Search for Extra Terrestrial Intelligence Project receives a transmission detailing an alien DNA structure, along with instructions on how to splice it with human DNA. The result is Sil, a sensual but deadly creature who can change from a beautiful woman to an armour-plated killing machine in the blink of an eye.",13.492845,/94P6kzKH8aPmQmPr9yZjgy7BtQQ.jpg,"[{'name': 'Metro-Goldwyn-Mayer (MGM)', 'id': 8411}]","[{'iso_3166_1': 'US', 'name': 'United States of America'}]",1995-07-07,113374103,108.0,"[{'iso_639_1': 'en', 'name': 'English'}]",Released,Our time is up.,Species,False,5.5,457
False,,0,"[{'id': 18, 'name': 'Drama'}]",,139408,tt0114534,en,The Stars Fell on Henrietta,"The setting is early America during the oil boom. An elderly, down on his luck 'oil man', Mr. Cox finds himself in the town of Henrietta. Using unconventional methods, he convinces himself and local Don Day that there is oil on Day's land. The financially strapped Day puts everything into finding oil...but at what cost?",0.913522,/5mkH38tcztyLy6CeAWHD1FC8ozC.jpg,"[{'name': 'Malpaso Productions', 'id': 171}, {'name': ""Butcher's Run Films"", 'id': 3864}, {'name': 'Warner Bros.', 'id': 6194}]","[{'iso_3166_1': 'US', 'name': 'United States of America'}]",1995-09-15,0,109.0,"[{'iso_639_1': 'hu', 'name': 'Magyar'}, {'iso_639_1': 'en', 'name': 'English'}]",Released,,The Stars Fell on Henrietta,False,6.6,6
False,,42000000,"[{'id': 80, 'name': 'Crime'}, {'id': 18, 'name': 'Drama'}, {'id': 878, 'name': 'Science Fiction'}, {'id': 53, 'name': 'Thriller'}]",http://www.strange-days.com,281,tt0114558,en,Strange Days,"Set in the year 1999 during the last days of the old millennium, the movie tells the story of Lenny Nero, an ex-cop who now deals with data-discs containing recorded memories and emotions. One day he receives a disc which contains the memories of a murderer killing a prostitute. Lenny investigates and is pulled deeper and deeper in a whirl of blackmail, murder and rape. Will he survive and solve the case?",11.223055,/rXvy5hG9OeVmgnv9w4IhQxhqEKD.jpg,"[{'name': 'Lightstorm Entertainment', 'id': 574}]","[{'iso_3166_1': 'US', 'name': 'United States of America'}]",1995-10-13,7959291,145.0,"[{'iso_639_1': 'en', 'name': 'English'}]",Released,You know you want it.,Strange Days,False,6.8,334
False,,0,"[{'id': 18, 'name': 'Drama'}, {'id': 10749, 'name': 'Romance'}]",,5967,tt0058450,fr,Les parapluies de Cherbourg,"This simple romantic tragedy begins in 1957. Guy Foucher, a 20-year-old French auto mechanic, has fallen in love with 17-year-old Geneviève Emery, an employee in her widowed mother's chic but financially embattled umbrella shop. On the evening before Guy is to leave for a two-year tour of combat in Algeria, he and Geneviève make love. She becomes pregnant and must choose between waiting for Guy's return or accepting an offer of marriage from a wealthy diamond merchant.",8.133881,/ju5W8qvWfjXXGaR7wd9wSyuYXhS.jpg,"[{'name': 'Beta Film', 'id': 1080}, {'name': 'Madeleine Films', 'id': 1147}, {'name': 'Parc Film', 'id': 14680}]","[{'iso_3166_1': 'DE', 'name': 'Germany'}, {'iso_3166_1': 'FR', 'name': 'France'}]",1964-02-19,0,91.0,"[{'iso_639_1': 'fr', 'name': 'Français'}]",Released,a film for all the young lovers of the world,The Umbrellas of Cherbourg,False,7.6,119
False,,14000000,"[{'id': 53, 'name': 'Thriller'}]",,79593,tt0114666,en,The Tie That Binds,John Netherwood and his wife Leann are fugitives who are both wanted for murder. They have a young daughter named Janie and they want her back.,1.820419,/uCPwXcYZ8G5Xi5h8zonBco980Dk.jpg,"[{'name': 'Hollywood Pictures', 'id': 915}, {'name': 'PolyGram Filmed Entertainment', 'id': 1382}, {'name': 'Interscope Communications', 'id': 10201}]","[{'iso_3166_1': 'US', 'name': 'United States of America'}]",1995-09-08,5780000,99.0,"[{'iso_639_1': 'en', 'name': 'English'}]",Released,,The Tie That Binds,False,4.6,9
False,,0,"[{'id': 18, 'name': 'Drama'}, {'id': 14, 'name': 'Fantasy'}]",,47939,tt0114663,en,Three Wishes,"While Jane Holman (Mastrantonio) is driving with her two sons, she accidentally runs into a drifter, Jack McCloud (Swayze), who breaks his leg. Being responsible,  Jane invites Jack, and his dog, to stay at her home until his leg has healed.  Jack struggles to adapt their lifestyle, and finds himself loved by the family. He starts teaching baseball to Tom, who misses his father, who was lost in the Korean war. Jack and Tom develop a strong bond of friendship. Meanwhile, Gunny believes that there is more to Jack and Betty Jane than meets the eye...  We learn that Jack, is Jack McCloud, a Star White Socks baseball player in 1941, who dropped out of the league, after his first season, and; ""was never heard from again"" ...  A wonderful story.  We witness magic between a boy's imagination, and Jack's dog, and are never sure if we are witnessing imagination or magic by the dog.  A story of friendship, family, and learning that life isn't always as cut and dried as we often believe.",11.002046,/ub79b63JJV4oeHwomSy5OS5fVsr.jpg,"[{'name': 'Savoy Pictures', 'id': 11308}]","[{'iso_3166_1': 'US', 'name': 'United States of America'}]",1995-10-27,7025496,115.0,"[{'iso_639_1': 'en', 'name': 'English'}]",Released,"If you really believe, magic will find you",Three Wishes,False,6.1,18
False,,0,"[{'id': 18, 'name': 'Drama'}, {'id': 10749, 'name': 'Romance'}]",,36834,tt0114702,en,Total Eclipse,"Young, wild poet Arthur Rimbaud and his mentor Paul Verlaine engage in a fierce, forbidden romance while feeling the effects of a hellish artistic lifestyle.",4.546552,/BTGFfPHySJtw2qBoLysz3ercDB.jpg,"[{'name': 'Société Française de Production (SFP)', 'id': 6849}, {'name': 'FIT Productions', 'id': 16026}, {'name': 'Portman Productions', 'id': 16027}]","[{'iso_3166_1': 'FR', 'name': 'France'}, {'iso_3166_1': 'BE', 'name': 'Belgium'}, {'iso_3166_1': 'GB', 'name': 'United Kingdom'}]",1995-11-02,339889,111.0,"[{'iso_639_1': 'en', 'name': 'English'}]",Released,Touched by Genius. Cursed by Madness. Blinded by Love.,Total Eclipse,False,6.5,112
False,,0,"[{'id': 35, 'name': 'Comedy'}]",,9090,tt0114682,en,"To Wong Foo, Thanks for Everything! Julie Newmar","Three New York drag queens on their way to Hollywood for a beauty pageant get stranded in a small Midwestern town for the entire weekend when their car breaks down. While waiting for parts for their Cadillac convertible, the flamboyant trio shows the local homophobic rednecks that appearing different doesn't mean they don't have humanity in common.",7.653446,/xIDEoG9FQGmMCh5XsbkvSuD8WrW.jpg,"[{'name': 'Universal Pictures', 'id': 33}, {'name': 'Amblin Entertainment', 'id': 56}]","[{'iso_3166_1': 'US', 'name': 'United States of America'}]",1995-09-07,47774193,105.0,"[{'iso_639_1': 'en', 'name': 'English'}, {'iso_639_1': 'es', 'name': 'Español'}]",Released,Attitude is everything,"To Wong Foo, Thanks for Everything! Julie Newmar",False,6.3,117
False,"{'id': 112399, 'name': 'Under Siege Collection', 'poster_path': '/5hkZdonGNmoqatnadpDnIgEbrho.jpg', 'backdrop_path': '/4Ysa3x4wDwolRpUXBCrig7szGon.jpg'}",60000000,"[{'id': 28, 'name': 'Action'}, {'id': 53, 'name': 'Thriller'}]",,3512,tt0114781,en,Under Siege 2: Dark Territory,"A passenger train has been hijacked by an electronics expert and turned into an untraceable command center for a weapons satellite. He has planned to blow up Washington DC and only one man can stop him, former Navy SEAL Casey Ryback.",7.490247,/6Z1p71nkm45cYuIZWOx5JSCYc0o.jpg,"[{'name': 'Regency Enterprises', 'id': 508}, {'name': 'Warner Bros.', 'id': 6194}, {'name': 'Seagal/Nasso Productions', 'id': 17825}, {'name': 'Victor Company of Japan (JVC)', 'id': 21480}, {'name': 'Cutting Edge Films', 'id': 63906}]","[{'iso_3166_1': 'US', 'name': 'United States of America'}]",1995-07-13,104324083,100.0,"[{'iso_639_1': 'en', 'name': 'English'}]",Released,Last time he rocked the boat. This time the sky's the limit.,Under Siege 2: Dark Territory,False,5.6,217
False,,0,"[{'id': 35, 'name': 'Comedy'}, {'id': 18, 'name': 'Drama'}, {'id': 10751, 'name': 'Family'}]",,52856,tt0114798,en,Unstrung Heroes,"Steven Lidz, unhappy with his home life since his mother got sick, goes and lives with his two crazy Uncles. There he changes and gets closer to his Uncles, but his parents want him home even though he is finally happy and popular. Written by Todd Weiser",2.881689,/puMRjRJYE5TX1ffwuqoLXW9iLqq.jpg,"[{'name': 'Hollywood Pictures', 'id': 915}]",[],1995-09-15,0,93.0,"[{'iso_639_1': 'en', 'name': 'English'}]",Released,Sometimes you find your heroes in the most unlikely places,Unstrung Heroes,False,6.4,9
False,,0,"[{'id': 99, 'name': 'Documentary'}]",,77350,tt0114805,en,Unzipped,"Using a variety of cinematographic techniques, the world of high- profile fashion designer Issac Mizrahi is portrayed as being driven by excitement and creativity, despite the concomitant chaos and cacophony. Mizrahi's frenzied genius and rollercoaster emotions paint a humorous and personal portrait of a brilliant designer. Famous ""SuperModels"", actors, and actresses populate Issac's rarified world, but Douglas Keeve's cameras capture the stress and turbulence beneath the placid coolness of glamour. Written by Tad Dibbern",0.786023,/5fY5iN8mUBLdd4fmcXwdTqAZ9Sx.jpg,[],"[{'iso_3166_1': 'US', 'name': 'United States of America'}]",1995-08-11,0,73.0,"[{'iso_639_1': 'en', 'name': 'English'}]",Released,,Unzipped,False,6.0,6
False,,20000000,"[{'id': 18, 'name': 'Drama'}, {'id': 10749, 'name': 'Romance'}]",,9560,tt0114887,en,A Walk in the Clouds,World War II vet Paul Sutton falls for a pregnant and unwed woman who persuades him -- during their first encounter -- to pose as her husband so she can face her family.,9.715639,/iZ4FNVYVUx6NS7HXMiNJTGgSo7H.jpg,"[{'name': 'Twentieth Century Fox Film Corporation', 'id': 306}, {'name': 'Zucker Brothers Productions', 'id': 2851}]","[{'iso_3166_1': 'US', 'name': 'United States of America'}]",1995-08-11,50012507,103.0,"[{'iso_639_1': 'en', 'name': 'English'}]",Released,A man in search. A woman in need. A story of fate.,A Walk in the Clouds,False,6.5,168
False,,175000000,"[{'id': 12, 'name': 'Adventure'}, {'id': 28, 'name': 'Action'}]",,9804,tt0114898,en,Waterworld,"In a futuristic world where the polar ice caps have melted and made Earth a liquid planet, a beautiful barmaid rescues a mutant seafarer from a floating island prison. They escape, along with her young charge, Enola, and sail off aboard his ship. But the trio soon becomes the target of a menacing pirate who covets the map to 'Dryland' – which is tattooed on Enola's back.",16.885184,/yordVJcPLh3VNRL7bXzFIBEhXRr.jpg,"[{'name': 'Universal Pictures', 'id': 33}, {'name': 'Gordon Company', 'id': 1073}, {'name': 'Davis Entertainment', 'id': 1302}, {'name': 'Licht/Mueller Film Corporation', 'id': 6092}]","[{'iso_3166_1': 'US', 'name': 'United States of America'}]",1995-07-28,264218220,135.0,"[{'iso_639_1': 'en', 'name': 'English'}, {'iso_639_1': 'de', 'name': 'Deutsch'}, {'iso_639_1': 'es', 'name': 'Español'}]",Released,Beyond the horizon lies the secret to a new beginning.,Waterworld,False,5.9,1017
False,,8000000,"[{'id': 18, 'name': 'Drama'}]",,31611,tt0114928,en,White Man's Burden,"The story takes place in alternative America where the blacks are members of social elite, and whites are inhabitants of inner city ghettos. Louis Pinnock is a white worker in a chocolate factory, loving husband and father of two children. While delivering a package for black CEO Thaddeus Thomas, he is mistaken for a voyeur and, as a result, loses his job, gets beaten by black cops and his family gets evicted from their home. Desperate Pinnock takes a gun and kidnaps Thomas, demanding justice.",1.834099,/aaFpmILNyNSReVgzKGFu8iKNYzi.jpg,"[{'name': 'HBO', 'id': 6068}, {'name': 'A BandApart', 'id': 6911}, {'name': 'Rysher Entertainment', 'id': 11661}]","[{'iso_3166_1': 'FR', 'name': 'France'}, {'iso_3166_1': 'US', 'name': 'United States of America'}]",1995-12-01,0,89.0,"[{'iso_639_1': 'en', 'name': 'English'}]",Released,Reality Just Switched Sides,White Man's Burden,False,5.1,25
False,,30000000,"[{'id': 28, 'name': 'Action'}, {'id': 37, 'name': 'Western'}]",,65796,tt0114938,en,Wild Bill,Biopic about famous gunslinger Wild Bill Hickock. The early career of legendary lawman is telescoped and culminates in his relocation in Deadwood and a reunion with Calamity Jane.,8.922139,/qIgslXL0NDtSlcHxISACLwWbkRJ.jpg,"[{'name': 'United Artists', 'id': 60}]",[],1995-12-01,0,98.0,"[{'iso_639_1': 'cn', 'name': '广州话 / 廣州話'}, {'iso_639_1': 'en', 'name': 'English'}]",Released,The Name Is Legendary. The Man Is Real.,Wild Bill,False,5.9,27
False,,0,"[{'id': 18, 'name': 'Drama'}]",,49805,tt0109340,en,The Browning Version,"Andrew Crocker-Harris is an embittered and disliked teacher of Greek and Latin at a British prep school. After nearly 20 years of service, he is being forced to retire on the pretext of his health, and perhaps may not even be given a pension. The boys regard him as a Hitler, with some justification. His wife Laura is unfaithful, and lives to wound him any way she can. Andrew must come to terms with his failed life and regain at least his own self-respect.",3.727644,/xjWc2uWrcGLwC87JN2CbxseGKQ.jpg,"[{'name': 'Paramount Pictures', 'id': 4}]","[{'iso_3166_1': 'GB', 'name': 'United Kingdom'}]",1994-10-12,0,97.0,"[{'iso_639_1': 'en', 'name': 'English'}]",Released,The greatest lessons in the life and the ones learned by heart.,The Browning Version,False,6.0,11
False,,0,"[{'id': 12, 'name': 'Adventure'}, {'id': 28, 'name': 'Action'}, {'id': 35, 'name': 'Comedy'}, {'id': 80, 'name': 'Crime'}, {'id': 10751, 'name': 'Family'}]",,26258,tt0112602,en,Bushwhacked,"A inept courier realises he has been used by criminals to deliver money. On the run from both the criminals and police, he poses as a Scout leader and leads a scout group on a hike through the mountains.",3.287036,/A4UQ0y2kj4ZXrBP0MXYazd69xp2.jpg,"[{'name': 'Twentieth Century Fox Film Corporation', 'id': 306}]","[{'iso_3166_1': 'US', 'name': 'United States of America'}]",1995-08-04,0,90.0,"[{'iso_639_1': 'en', 'name': 'English'}, {'iso_639_1': 'de', 'name': 'Deutsch'}]",Released,"They wanted a great adventure. What they got was ""Mad Max"" Grabelski.",Bushwhacked,False,4.9,29
