adult,belongs_to_collection,budget,genres,homepage,id,imdb_id,original_language,original_title,overview,popularity,poster_path,production_companies,production_countries,release_date,revenue,runtime,spoken_languages,status,tagline,title,video,vote_average,vote_count
False,"{'id': 10194, 'name': 'Toy Story Collection', 'poster_path': '/7G9915LfUQ2lVfwMEEhDsn3kT4B.jpg', 'backdrop_path': '/9FBwqcd9IRruEDUrTdcaafOMKUq.jpg'}",30000000,"[{'id': 16, 'name': 'Animation'}, {'id': 35, 'name': 'Comedy'}, {'id': 10751, 'name': 'Family'}]",http://toystory.disney.com/toy-story,862,tt0114709,en,Toy Story,"Led by Woody, Andy's toys live happily in his room until Andy's birthday brings Buzz Lightyear onto the scene. Afraid of losing his place in Andy's heart, Woody plots against Buzz. But when circumstances separate Buzz and Woody from their owner, the duo eventually learns to put aside their differences.",21.946943,/rhIRbceoE9lR4veEXuwCC2wARtG.jpg,"[{'name': 'Pixar Animation Studios', 'id': 3}]","[{'iso_3166_1': 'US', 'name': 'United States of America'}]",1995-10-30,373554033,81.0,"[{'iso_639_1': 'en', 'name': 'English'}]",Released,,Toy Story,False,7.7,5415
False,,65000000,"[{'id': 12, 'name': 'Adventure'}, {'id': 14, 'name': 'Fantasy'}, {'id': 10751, 'name': 'Family'}]",,8844,tt0113497,en,Jumanji,"When siblings Judy and Peter discover an enchanted board game that opens the door to a magical world, they unwittingly invite Alan -- an adult who's been trapped inside the game for 26 years -- into their living room. Alan's only hope for freedom is to finish the game, which proves risky as all three find themselves running from giant rhinoceroses, evil monkeys and other terrifying creatures.",17.015539,/vzmL6fP7aPKNKPRTFnZmiUfciyV.jpg,"[{'name': 'TriStar Pictures', 'id': 559}, {'name': 'Teitler Film', 'id': 2550}, {'name': 'Interscope Communications', 'id': 10201}]","[{'iso_3166_1': 'US', 'name': 'United States of America'}]",1995-12-15,262797249,104.0,"[{'iso_639_1': 'en', 'name': 'English'}, {'iso_639_1': 'fr', 'name': 'Français'}]",Released,Roll the dice and unleash the excitement!,Jumanji,False,6.9,2413
False,"{'id': 119050, 'name': 'Grumpy Old Men Collection', 'poster_path': '/nLvUdqgPgm3F85NMCii9gVFUcet.jpg', 'backdrop_path': '/hypTnLot2z8wpFS7qwsQHW1uV8u.jpg'}",0,"[{'id': 10749, 'name': 'Romance'}, {'id': 35, 'name': 'Comedy'}]",,15602,tt0113228,en,Grumpier Old Men,"A family wedding reignites the ancient feud between next-door neighbors and fishing buddies John and Max. Meanwhile, a sultry Italian divorcée opens a restaurant at the local bait shop, alarming the locals who worry she'll scare the fish away. But she's less interested in seafood than she is in cooking up a hot time with Max.",11.7129,/6ksm1sjKMFLbO7UY2i6G1ju9SML.jpg,"[{'name': 'Warner Bros.', 'id': 6194}, {'name': 'Lancaster Gate', 'id': 19464}]","[{'iso_3166_1': 'US', 'name': 'United States of America'}]",1995-12-22,0,101.0,"[{'iso_639_1': 'en', 'name': 'English'}]",Released,Still Yelling. Still Fighting. Still Ready for Love.,Grumpier Old Men,False,6.5,92
False,,16000000,"[{'id': 35, 'name': 'Comedy'}, {'id': 18, 'name': 'Drama'}, {'id': 10749, 'name': 'Romance'}]",,31357,tt0114885,en,Waiting to Exhale,"Cheated on, mistreated and stepped on, the women are holding their breath, waiting for the elusive ""good man"" to break a string of less-than-stellar lovers. Friends and confidants Vannah, Bernie, Glo and Robin talk it all out, determined to find a better way to breathe.",3.859495,/16XOMpEaLWkrcPqSQqhTmeJuqQl.jpg,"[{'name': 'Twentieth Century Fox Film Corporation', 'id': 306}]","[{'iso_3166_1': 'US', 'name': 'United States of America'}]",1995-12-22,81452156,127.0,"[{'iso_639_1': 'en', 'name': 'English'}]",Released,Friends are the people who let you be yourself... and never let you forget it.,Waiting to Exhale,False,6.1,34
False,"{'id': 96871, 'name': 'Father of the Bride Collection', 'poster_path': '/nts4iOmNnq7GNicycMJ9pSAn204.jpg', 'backdrop_path': '/7qwE57OVZmMJChBpLEbJEmzUydk.jpg'}",0,"[{'id': 35, 'name': 'Comedy'}]",,11862,tt0113041,en,Father of the Bride Part II,"Just when George Banks has recovered from his daughter's wedding, he receives the news that she's pregnant ... and that George's wife, Nina, is expecting too. He was planning on selling their home, but that's a plan that -- like George -- will have to change with the arrival of both a grandchild and a kid of his own.",8.387519,/e64sOI48hQXyru7naBFyssKFxVd.jpg,"[{'name': 'Sandollar Productions', 'id': 5842}, {'name': 'Touchstone Pictures', 'id': 9195}]","[{'iso_3166_1': 'US', 'name': 'United States of America'}]",1995-02-10,76578911,106.0,"[{'iso_639_1': 'en', 'name': 'English'}]",Released,Just When His World Is Back To Normal... He's In For The Surprise Of His Life!,Father of the Bride Part II,False,5.7,173
False,,60000000,"[{'id': 28, 'name': 'Action'}, {'id': 80, 'name': 'Crime'}, {'id': 18, 'name': 'Drama'}, {'id': 53, 'name': 'Thriller'}]",,949,tt0113277,en,Heat,"Obsessive master thief, Neil McCauley leads a top-notch crew on various insane heists throughout Los Angeles while a mentally unstable detective, Vincent Hanna pursues him without rest. Each man recognizes and respects the ability and the dedication of the other even though they are aware their cat-and-mouse game may end in violence.",17.924927,/zMyfPUelumio3tiDKPffaUpsQTD.jpg,"[{'name': 'Regency Enterprises', 'id': 508}, {'name': 'Forward Pass', 'id': 675}, {'name': 'Warner Bros.', 'id': 6194}]","[{'iso_3166_1': 'US', 'name': 'United States of America'}]",1995-12-15,187436818,170.0,"[{'iso_639_1': 'en', 'name': 'English'}, {'iso_639_1': 'es', 'name': 'Español'}]",Released,A Los Angeles Crime Saga,Heat,False,7.7,1886
False,,58000000,"[{'id': 35, 'name': 'Comedy'}, {'id': 10749, 'name': 'Romance'}]",,11860,tt0114319,en,Sabrina,"An ugly duckling having undergone a remarkable change, still harbors feelings for her crush: a carefree playboy, but not before his business-focused brother has something to say about it.",6.677277,/jQh15y5YB7bWz1NtffNZmRw0s9D.jpg,"[{'name': 'Paramount Pictures', 'id': 4}, {'name': 'Scott Rudin Productions', 'id': 258}, {'name': 'Mirage Enterprises', 'id': 932}, {'name': 'Sandollar Productions', 'id': 5842}, {'name': 'Constellation Entertainment', 'id': 14941}, {'name': 'Worldwide', 'id': 55873}, {'name': 'Mont Blanc Entertainment GmbH', 'id': 58079}]","[{'iso_3166_1': 'DE', 'name': 'Germany'}, {'iso_3166_1': 'US', 'name': 'United States of America'}]",1995-12-15,0,127.0,"[{'iso_639_1': 'fr', 'name': 'Français'}, {'iso_639_1': 'en', 'name': 'English'}]",Released,You are cordially invited to the most surprising merger of the year.,Sabrina,False,6.2,141
False,,0,"[{'id': 28, 'name': 'Action'}, {'id': 12, 'name': 'Adventure'}, {'id': 18, 'name': 'Drama'}, {'id': 10751, 'name': 'Family'}]",,45325,tt0112302,en,Tom and Huck,"A mischievous young boy, Tom Sawyer, witnesses a murder by the deadly Injun Joe. Tom becomes friends with Huckleberry Finn, a boy with no future and no family. Tom has to choose between honoring a friendship or honoring an oath because the town alcoholic is accused of the murder. Tom and Huck go through several adventures trying to retrieve evidence.",2.561161,/sGO5Qa55p7wTu7FJcX4H4xIVKvS.jpg,"[{'name': 'Walt Disney Pictures', 'id': 2}]","[{'iso_3166_1': 'US', 'name': 'United States of America'}]",1995-12-22,0,97.0,"[{'iso_639_1': 'en', 'name': 'English'}, {'iso_639_1': 'de', 'name': 'Deutsch'}]",Released,The Original Bad Boys.,Tom and Huck,False,5.4,45
False,,35000000,"[{'id': 28, 'name': 'Action'}, {'id': 12, 'name': 'Adventure'}, {'id': 53, 'name': 'Thriller'}]",,9091,tt0114576,en,Sudden Death,"International action superstar Jean Claude Van Damme teams with Powers Boothe in a Tension-packed, suspense thriller, set against the back-drop of a Stanley Cup game.Van Damme portrays a father whose daughter is suddenly taken during a championship hockey game. With the captors demanding a billion dollars by game's end, Van Damme frantically sets a plan in motion to rescue his daughter and abort an impending explosion before the final buzzer...",5.23158,/eoWvKD60lT95Ss1MYNgVExpo5iU.jpg,"[{'name': 'Universal Pictures', 'id': 33}, {'name': 'Imperial Entertainment', 'id': 21437}, {'name': 'Signature Entertainment', 'id': 23770}]","[{'iso_3166_1': 'US', 'name': 'United States of America'}]",1995-12-22,64350171,106.0,"[{'iso_639_1': 'en', 'name': 'English'}]",Released,Terror goes into overtime.,Sudden Death,False,5.5,174
False,"{'id': 645, 'name': 'James Bond Collection', 'poster_path': '/HORpg5CSkmeQlAolx3bKMrKgfi.jpg', 'backdrop_path': '/6VcVl48kNKvdXOZfJPdarlUGOsk.jpg'}",58000000,"[{'id': 12, 'name': 'Adventure'}, {'id': 28, 'name': 'Action'}, {'id': 53, 'name': 'Thriller'}]",http://www.mgm.com/view/movie/757/Goldeneye/,710,tt0113189,en,GoldenEye,James Bond must unmask the mysterious head of the Janus Syndicate and prevent the leader from utilizing the GoldenEye weapons system to inflict devastating revenge on Britain.,14.686036,/5c0ovjT41KnYIHYuF4AWsTe3sKh.jpg,"[{'name': 'United Artists', 'id': 60}, {'name': 'Eon Productions', 'id': 7576}]","[{'iso_3166_1': 'GB', 'name': 'United Kingdom'}, {'iso_3166_1': 'US', 'name': 'United States of America'}]",1995-11-16,352194034,130.0,"[{'iso_639_1': 'en', 'name': 'English'}, {'iso_639_1': 'ru', 'name': 'Pусский'}, {'iso_639_1': 'es', 'name': 'Español'}]",Released,No limits. No fears. No substitutes.,GoldenEye,False,6.6,1194
False,,62000000,"[{'id': 35, 'name': 'Comedy'}, {'id': 18, 'name': 'Drama'}, {'id': 10749, 'name': 'Romance'}]",,9087,tt0112346,en,The American President,"Widowed U.S. president Andrew Shepherd, one of the world's most powerful men, can have anything he wants -- and what he covets most is Sydney Ellen Wade, a Washington lobbyist. But Shepherd's attempts at courting her spark wild rumors and decimate his approval ratings.",6.318445,/lymPNGLZgPHuqM29rKMGV46ANij.jpg,"[{'name': 'Columbia Pictures', 'id': 5}, {'name': 'Castle Rock Entertainment', 'id': 97}]","[{'iso_3166_1': 'US', 'name': 'United States of America'}]",1995-11-17,107879496,106.0,"[{'iso_639_1': 'en', 'name': 'English'}]",Released,Why can't the most powerful man in the world have the one thing he wants most?,The American President,False,6.5,199
False,,0,"[{'id': 35, 'name': 'Comedy'}, {'id': 27, 'name': 'Horror'}]",,12110,tt0112896,en,Dracula: Dead and Loving It,"When a lawyer shows up at the vampire's doorstep, he falls prey to his charms and joins him in his search for fresh blood. Enter Dr. van Helsing, who may be the only one able to vanquish the count.",5.430331,/xve4cgfYItnOhtzLYoTwTVy5FGr.jpg,"[{'name': 'Columbia Pictures', 'id': 5}, {'name': 'Castle Rock Entertainment', 'id': 97}, {'name': 'Enigma Pictures', 'id': 6368}]","[{'iso_3166_1': 'FR', 'name': 'France'}, {'iso_3166_1': 'US', 'name': 'United States of America'}]",1995-12-22,0,88.0,"[{'iso_639_1': 'en', 'name': 'English'}, {'iso_639_1': 'de', 'name': 'Deutsch'}]",Released,,Dracula: Dead and Loving It,False,5.7,210
False,"{'id': 117693, 'name': 'Balto Collection', 'poster_path': '/w0ZgH6Lgxt2bQYnf1ss74UvYftm.jpg', 'backdrop_path': '/9VM5LiJV0bGb1st1KyHA3cVnO2G.jpg'}",0,"[{'id': 10751, 'name': 'Family'}, {'id': 16, 'name': 'Animation'}, {'id': 12, 'name': 'Adventure'}]",,21032,tt0112453,en,Balto,"An outcast half-wolf risks his life to prevent a deadly epidemic from ravaging Nome, Alaska.",12.140733,/gV5PCAVCPNxlOLFM1bKk50EqLXO.jpg,"[{'name': 'Universal Pictures', 'id': 33}, {'name': 'Amblin Entertainment', 'id': 56}, {'name': 'Amblimation', 'id': 4105}]","[{'iso_3166_1': 'US', 'name': 'United States of America'}]",1995-12-22,11348324,78.0,"[{'iso_639_1': 'en', 'name': 'English'}]",Released,Part Dog. Part Wolf. All Hero.,Balto,False,7.1,423
False,,44000000,"[{'id': 36, 'name': 'History'}, {'id': 18, 'name': 'Drama'}]",,10858,tt0113987,en,Nixon,"An all-star cast powers this epic look at American President Richard M. Nixon, a man carrying the fate of the world on his shoulders while battling the self-destructive demands within. Spanning his troubled boyhood in California to the shocking Watergate scandal that would end his presidency.",5.092,/cICkmCEiXRhvZmbuAlsA5D9B2rK.jpg,"[{'name': 'Hollywood Pictures', 'id': 915}, {'name': 'Cinergi Pictures Entertainment', 'id': 1504}]","[{'iso_3166_1': 'US', 'name': 'United States of America'}]",1995-12-22,13681765,192.0,"[{'iso_639_1': 'en', 'name': 'English'}]",Released,"Triumphant in Victory, Bitter in Defeat. He Changed the World, But Lost a Nation.",Nixon,False,7.1,72
False,,98000000,"[{'id': 28, 'name': 'Action'}, {'id': 12, 'name': 'Adventure'}]",,1408,tt0112760,en,Cutthroat Island,"Morgan Adams and her slave, William Shaw, are on a quest to recover the three portions of a treasure map. Unfortunately, the final portion is held by her murderous uncle, Dawg. Her crew is skeptical of her leadership abilities, so she must complete her quest before they mutiny against her. This is made yet more difficult by the efforts of the British crown to end her pirate raids.",7.284477,/odM9973kIv9hcjfHPp6g6BlyTIJ.jpg,"[{'name': 'Le Studio Canal+', 'id': 183}, {'name': 'Laurence Mark Productions', 'id': 415}, {'name': 'Metro-Goldwyn-Mayer (MGM)', 'id': 8411}, {'name': 'Carolco Pictures', 'id': 14723}]","[{'iso_3166_1': 'FR', 'name': 'France'}, {'iso_3166_1': 'DE', 'name': 'Germany'}, {'iso_3166_1': 'IT', 'name': 'Italy'}, {'iso_3166_1': 'US', 'name': 'United States of America'}]",1995-12-22,10017322,119.0,"[{'iso_639_1': 'en', 'name': 'English'}, {'iso_639_1': 'la', 'name': 'Latin'}]",Released,The Course Has Been Set. There Is No Turning Back. Prepare Your Weapons. Summon Your Courage. Discover the Adventure of a Lifetime!,Cutthroat Island,False,5.7,137
False,,52000000,"[{'id': 18, 'name': 'Drama'}, {'id': 80, 'name': 'Crime'}]",,524,tt0112641,en,Casino,The life of the gambling paradise – Las Vegas – and its dark mafia underbelly.,10.137389,/xo517ibXBDdYQY81j0WIG7BVcWq.jpg,"[{'name': 'Universal Pictures', 'id': 33}, {'name': 'Légende Entreprises', 'id': 10898}, {'name': 'Syalis DA', 'id': 11583}, {'name': 'De Fina-Cappa', 'id': 11584}]","[{'iso_3166_1': 'FR', 'name': 'France'}, {'iso_3166_1': 'US', 'name': 'United States of America'}]",1995-11-22,116112375,178.0,"[{'iso_639_1': 'en', 'name': 'English'}]",Released,No one stays at the top forever.,Casino,False,7.8,1343
False,,16500000,"[{'id': 18, 'name': 'Drama'}, {'id': 10749, 'name': 'Romance'}]",,4584,tt0114388,en,Sense and Sensibility,"Rich Mr. Dashwood dies, leaving his second wife and her daughters poor by the rules of inheritance. Two daughters are the titular opposites.",10.673167,/lA9HTy84Bb6ZwNeyoZKobcMdpMc.jpg,"[{'name': 'Columbia Pictures Corporation', 'id': 441}, {'name': 'Mirage Enterprises', 'id': 932}]","[{'iso_3166_1': 'GB', 'name': 'United Kingdom'}, {'iso_3166_1': 'US', 'name': 'United States of America'}]",1995-12-13,135000000,136.0,"[{'iso_639_1': 'en', 'name': 'English'}]",Released,Lose your heart and come to your senses.,Sense and Sensibility,False,7.2,364
False,,4000000,"[{'id': 80, 'name': 'Crime'}, {'id': 35, 'name': 'Comedy'}]",,5,tt0113101,en,Four Rooms,It's Ted the Bellhop's first night on the job...and the hotel's very unusual guests are about to place him in some outrageous predicaments. It seems that this evening's room service is serving up one unbelievable happening after another.,9.026586,/eQs5hh9rxrk1m4xHsIz1w11Ngqb.jpg,"[{'name': 'Miramax Films', 'id': 14}, {'name': 'A Band Apart', 'id': 59}]","[{'iso_3166_1': 'US', 'name': 'United States of America'}]",1995-12-09,4300000,98.0,"[{'iso_639_1': 'en', 'name': 'English'}]",Released,"Twelve outrageous guests. Four scandalous requests. And one lone bellhop, in his first day on the job, who's in for the wildest New year's Eve of his life.",Four Rooms,False,6.5,539
False,"{'id': 3167, 'name': 'Ace Ventura Collection', 'poster_path': '/qCxH543pScFed1CycwJ1nVgrkOc.jpg', 'backdrop_path': '/bswWgdDsLu0fhWMYUzLF8XgiK4h.jpg'}",30000000,"[{'id': 80, 'name': 'Crime'}, {'id': 35, 'name': 'Comedy'}, {'id': 12, 'name': 'Adventure'}]",,9273,tt0112281,en,Ace Ventura: When Nature Calls,"Summoned from an ashram in Tibet, Ace finds himself on a perilous journey into the jungles of Africa to find Shikaka, the missing sacred animal of the friendly Wachati tribe. He must accomplish this before the wedding of the Wachati's Princess to the prince of the warrior Wachootoos. If Ace fails, the result will be a vicious tribal war.",8.205448,/wRlGnJhEzcxBjvWtvbjhDSU1cIY.jpg,"[{'name': 'O Entertainment', 'id': 5682}, {'name': 'Warner Bros.', 'id': 6194}, {'name': 'Morgan Creek Productions', 'id': 10210}]","[{'iso_3166_1': 'US', 'name': 'United States of America'}]",1995-11-10,212385533,90.0,"[{'iso_639_1': 'en', 'name': 'English'}]",Released,New animals. New adventures. Same hair.,Ace Ventura: When Nature Calls,False,6.1,1128
False,,60000000,"[{'id': 28, 'name': 'Action'}, {'id': 35, 'name': 'Comedy'}, {'id': 80, 'name': 'Crime'}]",,11517,tt0113845,en,Money Train,"A vengeful New York transit cop decides to steal a trainload of subway fares; his foster brother, a fellow cop, tries to protect him.",7.337906,/jSozzzVOR2kfXgTUuGnbgG2yRFi.jpg,"[{'name': 'Columbia Pictures', 'id': 5}]","[{'iso_3166_1': 'US', 'name': 'United States of America'}]",1995-11-21,35431113,103.0,"[{'iso_639_1': 'en', 'name': 'English'}]",Released,"Get on, or GET OUT THE WAY!",Money Train,False,5.4,224
False,"{'id': 91698, 'name': 'Chili Palmer Collection', 'poster_path': '/ae3smJDdWrMJ77tDpYOrpo4frKq.jpg', 'backdrop_path': '/uWaANGQeoSs5vSP1CWtlkDrkqei.jpg'}",30250000,"[{'id': 35, 'name': 'Comedy'}, {'id': 53, 'name': 'Thriller'}, {'id': 80, 'name': 'Crime'}]",,8012,tt0113161,en,Get Shorty,"Chili Palmer is a Miami mobster who gets sent by his boss, the psychopathic ""Bones"" Barboni, to collect a bad debt from Harry Zimm, a Hollywood producer who specializes in cheesy horror films. When Chili meets Harry's leading lady, the romantic sparks fly. After pitching his own life story as a movie idea, Chili learns that being a mobster and being a Hollywood producer really aren't all that different.",12.669608,/vWtDUUgQAsVyvRW4mE75LBgVm2e.jpg,"[{'name': 'Jersey Films', 'id': 216}, {'name': 'Metro-Goldwyn-Mayer (MGM)', 'id': 8411}]","[{'iso_3166_1': 'US', 'name': 'United States of America'}]",1995-10-20,115101622,105.0,"[{'iso_639_1': 'en', 'name': 'English'}]",Released,"The mob is tough, but it’s nothing like show business.",Get Shorty,False,6.4,305
False,,0,"[{'id': 18, 'name': 'Drama'}, {'id': 53, 'name': 'Thriller'}]",,1710,tt0112722,en,Copycat,An agoraphobic psychologist and a female detective must work together to take down a serial killer who copies serial killers from the past.,10.701801,/80czeJGSoik22fhtUM9WzyjUU4r.jpg,"[{'name': 'Regency Enterprises', 'id': 508}, {'name': 'New Regency Pictures', 'id': 10104}]","[{'iso_3166_1': 'US', 'name': 'United States of America'}]",1995-10-27,0,124.0,"[{'iso_639_1': 'en', 'name': 'English'}, {'iso_639_1': 'de', 'name': 'Deutsch'}]",Released,"One man is copying the most notorious killers in history one at a time. Together, two women must stop him from killing again. Or they're next.",Copycat,False,6.5,199
False,,50000000,"[{'id': 28, 'name': 'Action'}, {'id': 12, 'name': 'Adventure'}, {'id': 80, 'name': 'Crime'}, {'id': 53, 'name': 'Thriller'}]",,9691,tt0112401,en,Assassins,"Assassin Robert Rath arrives at a funeral to kill a prominent mobster, only to witness a rival hired gun complete the job for him -- with grisly results. Horrified by the murder of innocent bystanders, Rath decides to take one last job and then return to civilian life. But finding his way out of the world of contract killing grows ever more dangerous as Rath falls for his female target and becomes a marked man himself.",11.065939,/xAx5MP7Dg4y85pyS7atX6eWk4Qd.jpg,"[{'name': 'Silver Pictures', 'id': 1885}, {'name': 'Canal+', 'id': 5358}, {'name': 'Warner Bros.', 'id': 6194}, {'name': 'Dino De Laurentiis Company', 'id': 10308}, {'name': 'Donner/Shuler-Donner Productions', 'id': 23397}, {'name': 'Evansgideon/Lazar', 'id': 25061}]","[{'iso_3166_1': 'FR', 'name': 'France'}, {'iso_3166_1': 'US', 'name': 'United States of America'}]",1995-10-06,30303072,132.0,"[{'iso_639_1': 'en', 'name': 'English'}, {'iso_639_1': 'es', 'name': 'Español'}, {'iso_639_1': 'nl', 'name': 'Nederlands'}]",Released,"In the shadows of life, In the business of death, One man found a reason to live...",Assassins,False,6.0,394
False,,0,"[{'id': 18, 'name': 'Drama'}, {'id': 14, 'name': 'Fantasy'}, {'id': 878, 'name': 'Science Fiction'}, {'id': 53, 'name': 'Thriller'}]",,12665,tt0114168,en,Powder,"Harassed by classmates who won't accept his shocking appearance, a shy young man known as ""Powder"" struggles to fit in. But the cruel taunts stop when Powder displays a mysterious power that allows him to do incredible things. This phenomenon changes the lives of all those around him in ways they never could have imagined.",12.133094,/1uRKsxOCtgz0xVqs9l4hYtp4dFm.jpg,"[{'name': 'Caravan Pictures', 'id': 175}, {'name': 'Hollywood Pictures', 'id': 915}]","[{'iso_3166_1': 'US', 'name': 'United States of America'}]",1995-10-27,0,111.0,"[{'iso_639_1': 'en', 'name': 'English'}]",Released,An extraordinary encounter with another human being.,Powder,False,6.3,143
False,,3600000,"[{'id': 18, 'name': 'Drama'}, {'id': 10749, 'name': 'Romance'}]",http://www.mgm.com/title_title.do?title_star=LEAVINGL,451,tt0113627,en,Leaving Las Vegas,"Ben Sanderson, an alcoholic Hollywood screenwriter who lost everything because of his drinking, arrives in Las Vegas to drink himself to death. There, he meets and forms an uneasy friendship and non-interference pact with prostitute Sera.",10.332025,/37qHRJxnSh5YkuaN9FgfNnMl3Tj.jpg,"[{'name': 'United Artists', 'id': 60}, {'name': 'Intial Productions', 'id': 15547}]","[{'iso_3166_1': 'US', 'name': 'United States of America'}]",1995-10-27,49800000,112.0,"[{'iso_639_1': 'en', 'name': 'English'}]",Released,I Love You... The Way You Are.,Leaving Las Vegas,False,7.1,365
False,,0,"[{'id': 18, 'name': 'Drama'}]",,16420,tt0114057,en,Othello,The evil Iago pretends to be friend of Othello in order to manipulate him to serve his own end in the film version of this Shakespeare classic.,1.845899,/qM0BXEQjmnAzlkDZ0tYmV6twqMX.jpg,"[{'name': 'Columbia Pictures', 'id': 5}, {'name': 'Castle Rock Entertainment', 'id': 97}]","[{'iso_3166_1': 'IT', 'name': 'Italy'}]",1995-12-15,0,123.0,"[{'iso_639_1': 'en', 'name': 'English'}]",Released,"Envy, greed, jealousy and love.",Othello,False,7.0,33
False,,12000000,"[{'id': 35, 'name': 'Comedy'}, {'id': 18, 'name': 'Drama'}, {'id': 10751, 'name': 'Family'}]",,9263,tt0114011,en,Now and Then,"Waxing nostalgic about the bittersweet passage from childhood to puberty in this tender coming-of-age tale, four childhood girlfriends -- Teeny, Chrissy, Samantha and Roberta -- recall the magical summer of 1970. During their walk down memory lane, they reconcile experiences with boys, secrets, bullies and more.",8.681325,/wD6rLdD2Ix3u9YLgE3Do8GyCHoz.jpg,"[{'name': 'New Line Cinema', 'id': 12}]","[{'iso_3166_1': 'US', 'name': 'United States of America'}]",1995-10-20,27400000,100.0,"[{'iso_639_1': 'en', 'name': 'English'}]",Released,In every woman there is the girl she left behind.,Now and Then,False,6.6,91
False,,0,"[{'id': 18, 'name': 'Drama'}, {'id': 10749, 'name': 'Romance'}]",,17015,tt0114117,en,Persuasion,"This film adaptation of Jane Austen's last novel follows Anne Elliot, the daughter of a financially troubled aristocratic family, who is persuaded to break her engagement to Frederick Wentworth, a young sea captain of meager means. Years later, money troubles force Anne's father to rent out the family estate to Admiral Croft, and Anne is again thrown into company with Frederick -- who is now rich, successful and perhaps still in love with Anne.",2.228434,/si8911IezMvAnQFDvyg1nKzDlD.jpg,"[{'name': 'BBC Films', 'id': 288}]","[{'iso_3166_1': 'GB', 'name': 'United Kingdom'}, {'iso_3166_1': 'FR', 'name': 'France'}]",1995-09-27,0,104.0,"[{'iso_639_1': 'en', 'name': 'English'}]",Released,,Persuasion,False,7.4,36
False,,18000000,"[{'id': 14, 'name': 'Fantasy'}, {'id': 878, 'name': 'Science Fiction'}, {'id': 12, 'name': 'Adventure'}]",,902,tt0112682,fr,La Cité des Enfants Perdus,"A scientist in a surrealist society kidnaps children to steal their dreams, hoping that they slow his aging process.",9.822423,/eVo6ewq4akfyJYy3GXkMsLNzEJc.jpg,"[{'name': 'Procirep', 'id': 311}, {'name': 'Constellation Productions', 'id': 590}, {'name': 'France 3 Cinéma', 'id': 591}, {'name': 'Claudie Ossard Productions', 'id': 592}, {'name': 'Eurimages', 'id': 850}, {'name': 'MEDIA Programme of the European Union', 'id': 851}, {'name': 'Cofimage 5', 'id': 1871}, {'name': 'Televisión Española (TVE)', 'id': 6639}, {'name': 'Tele München Fernseh Produktionsgesellschaft (TMG)', 'id': 7237}, {'name': ""Club d'Investissement Média"", 'id': 8170}, {'name': 'Canal+ España', 'id': 9335}, {'name': 'Elías Querejeta Producciones Cinematográficas S.L.', 'id': 12009}, {'name': 'Centre National de la Cinématographie (CNC)', 'id': 18367}, {'name': 'Victoires Productions', 'id': 25020}, {'name': 'Constellation', 'id': 25021}, {'name': 'Lumière Pictures', 'id': 25129}, {'name': 'Canal+', 'id': 47532}, {'name': 'Studio Image', 'id': 68517}, {'name': 'Cofimage 4', 'id': 79437}, {'name': 'Ossane', 'id': 79438}, {'name': 'Phoenix Images', 'id': 79439}]","[{'iso_3166_1': 'FR', 'name': 'France'}, {'iso_3166_1': 'DE', 'name': 'Germany'}, {'iso_3166_1': 'ES', 'name': 'Spain'}]",1995-05-16,1738611,108.0,"[{'iso_639_1': 'cn', 'name': '广州话 / 廣州話'}, {'iso_639_1': 'fr', 'name': 'Français'}]",Released,Where happily ever after is just a dream.,The City of Lost Children,False,7.6,308
