adult,belongs_to_collection,budget,genres,homepage,id,imdb_id,original_language,original_title,overview,popularity,poster_path,production_companies,production_countries,release_date,revenue,runtime,spoken_languages,status,tagline,title,video,vote_average,vote_count
False,,0,"[{'id': 18, 'name': 'Drama'}]",,32119,tt0106473,en,The Boys of St. Vincent,The true story of boys being sexually abused at their orphanage ran by a religious community in Newfoundland.,0.86539,/zC4WsoeXN2wCrUjNzu4iu7ph17Z.jpg,[],"[{'iso_3166_1': 'CA', 'name': 'Canada'}]",1992-12-06,0,90.0,"[{'iso_639_1': 'en', 'name': 'English'}]",Released,,The Boys of St. Vincent,False,7.0,7
False,,40000000,"[{'id': 35, 'name': 'Comedy'}, {'id': 10749, 'name': 'Romance'}]",,11066,tt0103859,en,Boomerang,"Marcus is a successful advertising executive who woos and beds women almost at will. After a company merger he finds that his new boss, the ravishing Jacqueline, is treating him in exactly the same way. Completely traumatised by this, his work goes badly downhill.",6.506983,/3dDufFHAuVXpfMdXkDUC0M0Y5TL.jpg,"[{'name': 'Paramount Pictures', 'id': 4}]","[{'iso_3166_1': 'US', 'name': 'United States of America'}]",1992-06-30,70100000,117.0,"[{'iso_639_1': 'fr', 'name': 'Français'}, {'iso_639_1': 'en', 'name': 'English'}]",Released,A Player Who's About to be Played.,Boomerang,False,5.4,139
False,,0,"[{'id': 18, 'name': 'Drama'}, {'id': 35, 'name': 'Comedy'}, {'id': 10749, 'name': 'Romance'}]",,11104,tt0109424,cn,重慶森林,"Every day, Cop 223 buys a can of pineapple with an expiration date of May 1, symbolizing the day he'll get over his lost love. He's also got his eye on a mysterious woman in a blond wig, oblivious of the fact she's a drug dealer. Cop 663 is distraught with heartbreak over a breakup. But when his ex drops a spare set of his keys at a local cafe, a waitress lets herself into his apartment and spruces up his life.",6.778979,/yQUjZTzwgskqOJdr3jhwQ4yTkvb.jpg,"[{'name': 'Jet Tone Production', 'id': 540}, {'name': 'The Criterion Collection', 'id': 10932}]","[{'iso_3166_1': 'HK', 'name': 'Hong Kong'}]",1994-07-14,0,102.0,"[{'iso_639_1': 'cn', 'name': '广州话 / 廣州話'}, {'iso_639_1': 'en', 'name': 'English'}, {'iso_639_1': 'ja', 'name': '日本語'}, {'iso_639_1': 'zh', 'name': '普通话'}]",Released,What a difference a day makes,Chungking Express,False,7.9,249
False,,0,"[{'id': 18, 'name': 'Drama'}, {'id': 10749, 'name': 'Romance'}]",,37975,tt0114808,it,L'uomo delle stelle,The adventures and deceptions of a photographer who travels through the small villages of Sicily pretending that he is working for the big film studios in Rome.,1.702639,/zRLV8Gz4x3k4Dc4Zxbmz7jsqNoN.jpg,"[{'name': 'Cecchi Gori Group Tiger Cinematografica', 'id': 371}]","[{'iso_3166_1': 'IT', 'name': 'Italy'}]",1995-09-21,0,113.0,"[{'iso_639_1': 'it', 'name': 'Italiano'}]",Released,"In the golden age of cinema, everyone dreams of becoming a star. One man promises to make all their dreams come true...",The Star Maker,False,6.8,29
False,,7000000,"[{'id': 35, 'name': 'Comedy'}, {'id': 10749, 'name': 'Romance'}]",,2074,tt0116324,en,Flirting with Disaster,"Adopted as a child, new father Mel Colpin (Ben Stiller) decides he cannot name his son until he knows his birth parents, and determines to make a cross-country quest to find them. Accompanied by his wife, Nancy (Patricia Arquette), and an inept yet gorgeous adoption agent, Tina (Tea Leoni), he departs on an epic road trip that quickly devolves into a farce of mistaken identities, wrong turns, and overzealous and love-struck ATF agents (Josh Brolin, Richard Jenkins).",5.579088,/pxxYa68L05ZR4vMwc6yB8KqXslo.jpg,"[{'name': 'Miramax Films', 'id': 14}]","[{'iso_3166_1': 'US', 'name': 'United States of America'}]",1996-03-22,14702438,92.0,"[{'iso_639_1': 'en', 'name': 'English'}]",Released,"A comedy about sex, love, family and other accidents waiting to happen.",Flirting with Disaster,False,6.3,66
False,"{'id': 91430, 'name': 'The Neverending Story Collection', 'poster_path': '/tXuOhgEbXoba7vVIybzGlnycoNq.jpg', 'backdrop_path': '/2IqXJIR1i0f6Ngq3A6rjXhQNqFc.jpg'}",17000000,"[{'id': 14, 'name': 'Fantasy'}]",,27793,tt0110647,en,The NeverEnding Story III,A young boy must restore order when a group of bullies steal the magical book that acts as a portal between Earth and the imaginary world of Fantasia.,6.252377,/driZCEKL79PaCsZNICSU3xd59sk.jpg,"[{'name': 'Studio Babelsberg', 'id': 264}, {'name': 'Dieter Geissler Filmproduktion', 'id': 1766}, {'name': 'Cinevox Filmproduktion GmbH', 'id': 1979}, {'name': 'Warner Bros.', 'id': 6194}, {'name': 'Miramax', 'id': 53009}]","[{'iso_3166_1': 'DE', 'name': 'Germany'}, {'iso_3166_1': 'US', 'name': 'United States of America'}]",1994-10-26,0,95.0,"[{'iso_639_1': 'en', 'name': 'English'}]",Released,It's a brand new beginning in the adventure that never ends,The Neverending Story III: Escape from Fantasia,False,4.4,105
False,,0,"[{'id': 18, 'name': 'Drama'}]",,44284,tt0111055,ar,صمت القصور,The death of a prince brings a young woman back to the palace where she was born into servitude. The lingering legacy of the harem is brought into light from behind frosted windows and velvet curtains.,0.406754,/3M4bH7A2L6wrHeueTUwr5PKYkfS.jpg,"[{'name': 'Canal Horizons', 'id': 22029}, {'name': 'Mat Films', 'id': 22618}, {'name': 'Cinétéléfilms', 'id': 71842}]","[{'iso_3166_1': 'TN', 'name': 'Tunisia'}, {'iso_3166_1': 'FR', 'name': 'France'}]",1994-09-30,0,116.0,"[{'iso_639_1': 'ar', 'name': 'العربية'}, {'iso_639_1': 'fr', 'name': 'Français'}]",Released,,The Silences of the Palace,False,4.3,3
False,,0,[],,290157,tt0110217,en,Jupiter's Wife,"Michel Negroponte, a documentary filmmaker, meets Maggie one day in Central Park. Maggie claims to be married to the god Jupiter and the daughter of actor Robert Ryan. Michel gets to know Maggie over the next couple of years, and attempts to use her often outlandish stories as clues to reconstruct her past.
 - Written by James Meek",0.001178,/uUi23HjvDFYGfuVlCBGozUY1Ab4.jpg,[],[],1995-01-01,0,87.0,[],Released,A Haunting Real Life Mystery,Jupiter's Wife,False,0.0,0
False,,0,"[{'id': 35, 'name': 'Comedy'}, {'id': 10749, 'name': 'Romance'}]",,110972,tt0114131,en,Pie in the Sky,Pie in the Sky is a 1996 American romantic comedy film about a young man obsessed with traffic gridlock who falls in love with an avant-garde dancer.,0.699066,/6KO5jsPOr80J8PkKXPE8fym5I2R.jpg,[],[],1996-02-09,0,95.0,"[{'iso_639_1': 'en', 'name': 'English'}]",Released,The only thing that stands in the way of fate and true love is a little traffic.,Pie in the Sky,False,7.0,2
False,,0,"[{'id': 35, 'name': 'Comedy'}, {'id': 18, 'name': 'Drama'}]",,32622,tt0112364,en,Angela,"A ten year old girl named Angela leads her six year old sister, Ellie, through various regimens of 'purification' in an attempt to rid themselves of their evil, which she believes to be the cause of their mother's mental illness. Precocious, to say the least, Angela has visions of Lucifer coming to take her and her sister away, and one of her remedies for this is for them to remain within a circle of their dolls and toys until they see a vision of the virgin Mary come to them. But such thinking can only lead to an ending befitting of her own mental state.",2.197439,/dw5RWgSSDV5h3ZKS0oSzPe6A26p.jpg,[],"[{'iso_3166_1': 'US', 'name': 'United States of America'}]",1995-01-01,0,99.0,"[{'iso_639_1': 'en', 'name': 'English'}]",Released,,Angela,False,5.6,9
False,,0,"[{'id': 18, 'name': 'Drama'}, {'id': 10749, 'name': 'Romance'}, {'id': 10752, 'name': 'War'}]",,73067,tt0113107,it,Frankie Starlight,The quirky story of a young boy's adventures growing up with his stunningly beautiful mother and the two very different men who love her.,0.637554,/1cPX7MWnEYG21tSdEpWlFygZUwY.jpg,"[{'name': 'Fine Line Features', 'id': 8}, {'name': 'Channel Four Films', 'id': 181}, {'name': 'Bórd Scannán na hÉireann', 'id': 1898}, {'name': 'Canal+', 'id': 5358}]","[{'iso_3166_1': 'GB', 'name': 'United Kingdom'}, {'iso_3166_1': 'US', 'name': 'United States of America'}, {'iso_3166_1': 'FR', 'name': 'France'}, {'iso_3166_1': 'IE', 'name': 'Ireland'}]",1995-11-22,0,101.0,"[{'iso_639_1': 'en', 'name': 'English'}]",Released,Sometimes the brightest star is the one that shines within.,Frankie Starlight,False,5.4,4
False,,50000000,"[{'id': 28, 'name': 'Action'}, {'id': 53, 'name': 'Thriller'}, {'id': 9648, 'name': 'Mystery'}, {'id': 10749, 'name': 'Romance'}]",,11863,tt0113451,en,Jade,"Someone does a nasty hatchet job on a San Fransisco big noise and the Assistant D.A. takes charge of the investigation. Through a web of blackmail and prostitution involving the Governor, an old lover of the law man emerges as a prime suspect and he has to deal with his personal feelings as well as the case.",11.418917,/koKHFZ0FYd7yG1g3RphU6TQRVOg.jpg,"[{'name': 'Paramount Pictures', 'id': 4}]","[{'iso_3166_1': 'US', 'name': 'United States of America'}]",1995-10-13,9851610,95.0,"[{'iso_639_1': 'en', 'name': 'English'}]",Released,Some fantasies go too far.,Jade,False,5.1,45
False,,0,"[{'id': 35, 'name': 'Comedy'}, {'id': 18, 'name': 'Drama'}, {'id': 10749, 'name': 'Romance'}]",,55475,tt0114015,es,Nueba Yol,"Balbuena is a genial illegal immigrant who makes his way to New York City to take a bite out of the Big Apple. But his hopes of finding a better life soon begin to fade as Balbuena encounters one obstacle after another in the hardscrabble, uncaring metropolis.",0.291021,/1VNalbjNQkKejRnHW2XM6SwnCa0.jpg,"[{'name': 'Cigua Films', 'id': 93488}, {'name': ""D'Pelicula"", 'id': 93489}]","[{'iso_3166_1': 'DO', 'name': 'Dominican Republic'}]",1995-08-16,0,102.0,"[{'iso_639_1': 'es', 'name': 'Español'}]",Released,,Nueba Yol,False,5.5,1
False,,0,"[{'id': 10402, 'name': 'Music'}, {'id': 99, 'name': 'Documentary'}]",,124636,tt0114500,en,Sonic Outlaws,"Within days after the release of Negativland's clever parody of U2 and Casey Kasem, recording industry giant Island Records descended upon the band with a battery of lawyers intent on erasing the piece from the history of rock music.  Craig ""Tribulation 99"" Baldwin follows this and other intellectual property controversies across the contemporary arts scene. Playful and ironic, his cut-and-paste collage-essay surveys the prospects for an ""electronic folk culture"" in the midst of an increasingly commodified corporate media landscape.",0.001838,/wU4NBvZdP1wTAq142OR5knnhfG5.jpg,[],"[{'iso_3166_1': 'US', 'name': 'United States of America'}]",1995-08-01,0,87.0,"[{'iso_639_1': 'en', 'name': 'English'}]",Released,,Sonic Outlaws,False,0.0,0
False,,0,"[{'id': 35, 'name': 'Comedy'}]",,9101,tt0116130,en,Down Periscope,"Bumbling Navy lieutenant Tom Dodge has been given one last chance to clean up his record. But Admiral Graham, his nemesis, assigns Dodge to the Stingray, a submarine that can barely keep afloat. To add insult to injury, the Stingray is to be the enemy flagship in the upcoming war games … and to make matters even worse, Dodge's crew is a band of idiots even more incompetent that he is!",5.184977,/q6JEjedx4LoZRig8U1R5sJqBfti.jpg,"[{'name': 'Twentieth Century Fox Film Corporation', 'id': 306}]","[{'iso_3166_1': 'US', 'name': 'United States of America'}]",1996-03-01,0,92.0,"[{'iso_639_1': 'en', 'name': 'English'}]",Released,"A rusty sub. A rebel commander. A renegade crew. When destiny called, they should have hung up.",Down Periscope,False,5.6,110
False,,0,"[{'id': 99, 'name': 'Documentary'}]",,123360,tt0113125,en,From the Journals of Jean Seberg,"Mark Rappaport's creative bio-pic about actress Jean Seberg is presented in a first-person, autobiographical format (with Seberg played by Mary Beth Hurt). He seamlessly interweaves cinema, politics, American society and culture, and film theory to inform, entertain, and move the viewer. Seberg's many marriages, as well as her film roles, are discussed extensively. Her involvement with the Black Panther Movement and subsequent investigation by the FBI is covered. Notably, details of French New Wave cinema, Russian Expressionist (silent) films, and the careers of Jane Fonda, Vanessa Redgrave, and Clint Eastwood are also intensively examined. Much of the film is based on conjecture, but Rappaport encourages viewers to re-examine their ideas about women in film with this thought-provoking picture.",0.276401,/wfPHta8Wxm4LQVHU8tRhL8GCyIz.jpg,"[{'name': 'Couch Potatoe Productions', 'id': 68229}]","[{'iso_3166_1': 'US', 'name': 'United States of America'}]",1995-09-08,0,97.0,"[{'iso_639_1': 'en', 'name': 'English'}]",Released,,From the Journals of Jean Seberg,False,6.5,2
False,,0,"[{'id': 35, 'name': 'Comedy'}]",,5757,tt0113756,en,Man of the Year,"First-time director Dirk Shafer also penned this raucous ""mockumentary,"" a blend of fact and fiction that re-creates his 1992 reign as Playgirl magazine's Centerfold of the Year. When Shafer chooses to keep the fact that he's gay a secret from the magazine's editors, he finds himself living the ultimate lie -- and incapable of giving female readers what they really want. Will he succumb to his lover's pressures to come out of the closet?",0.540436,/nKYRDhGlbvQpXJnyMm7fcFDtm6P.jpg,[],"[{'iso_3166_1': 'US', 'name': 'United States of America'}]",1995-09-15,209935,86.0,"[{'iso_639_1': 'en', 'name': 'English'}]",Released,He as a centerfold who revealed everything ... but the truth.,Man of the Year,False,3.8,2
False,,0,"[{'id': 18, 'name': 'Drama'}]",,39428,tt0113952,en,The Neon Bible,"While on a train, a teenage boy thinks about his life and the flamboyant aunt whose friendship acted as an emotional shield from his troubled family. This film evokes the haunting quality of memory while creating a heartfelt portrait of a boy's life in a rural 1940s Southern town.",0.370342,/wpaZXRvhdNhmaedy8BMytuOXvGO.jpg,"[{'name': 'Channel Four Films', 'id': 181}, {'name': 'Academy', 'id': 38778}, {'name': 'Mayfair Films', 'id': 94477}, {'name': 'Iberoamerica Films', 'id': 94478}]","[{'iso_3166_1': 'GB', 'name': 'United Kingdom'}]",1995-08-23,0,91.0,"[{'iso_639_1': 'en', 'name': 'English'}]",Released,,The Neon Bible,False,7.2,5
False,,0,[],,124639,tt0114618,en,Target,A subtle yet violent commentary on feudal lords.,0.001205,/z0ezqAFMeGYd5mLEWaN8jC9eczF.jpg,[],[],1995-08-01,0,122.0,[],Released,,Target,False,0.0,0
False,,60000000,"[{'id': 18, 'name': 'Drama'}, {'id': 10749, 'name': 'Romance'}]",,9302,tt0118055,en,Up Close & Personal,"Tally Atwater has a dream: to be a prime-time network newscaster. She pursues this dream with nothing but ambition, raw talent and a homemade demo tape. Warren Justice is a brilliant, hard edged, veteran newsman. He sees Tally has talent and becomes her mentor. Tally’s career takes a meteoric rise and she and Warren fall in love. The romance that results is as intense and revealing as television news itself. Yet, each breaking story, every videotaped crisis that brings them together, also threatens to drive them apart...",3.402749,/bxRJQjCsJu6j4lvphjVJ5knNebs.jpg,"[{'name': 'Cinergi Pictures Entertainment', 'id': 1504}, {'name': 'Touchstone Pictures', 'id': 9195}]","[{'iso_3166_1': 'US', 'name': 'United States of America'}]",1996-03-01,0,119.0,"[{'iso_639_1': 'fr', 'name': 'Français'}]",Released,"Every Day we Have, is One More Than We Deserve.",Up Close & Personal,False,5.9,51
False,,31000000,"[{'id': 35, 'name': 'Comedy'}]",,11000,tt0115685,en,The Birdcage,A gay cabaret owner and his drag queen companion agree to put up a false straight front so that their son can introduce them to his fiancé's right-wing moralistic parents.,6.49968,/wRTkvqRTB05gcGInsnGqVgLkb3t.jpg,"[{'name': 'United Artists', 'id': 60}]","[{'iso_3166_1': 'US', 'name': 'United States of America'}]",1996-03-08,185260553,117.0,"[{'iso_639_1': 'en', 'name': 'English'}, {'iso_639_1': 'fr', 'name': 'Français'}]",Released,Come as you are.,The Birdcage,False,6.7,303
False,,0,"[{'id': 18, 'name': 'Drama'}]",,249882,tt0113200,en,Gospa,"In 1981 in Medjugorje (BA), a group of kids claim that Virgin Mary appeared to them on a hill. The local priest believes them and spreads the word. Religious tourism blossoms. The communist government is concerned and arrests the priest.",0.918504,/b8niK1RquKFR7TZBJbWN8zZPCcT.jpg,[],"[{'iso_3166_1': 'HR', 'name': 'Croatia'}, {'iso_3166_1': 'CA', 'name': 'Canada'}, {'iso_3166_1': 'US', 'name': 'United States of America'}]",1995-10-12,0,125.0,"[{'iso_639_1': 'en', 'name': 'English'}, {'iso_639_1': 'hr', 'name': 'Hrvatski'}, {'iso_639_1': 'bs', 'name': 'Bosanski'}]",Released,,Virgin Mary,False,7.0,2
False,,0,"[{'id': 35, 'name': 'Comedy'}, {'id': 18, 'name': 'Drama'}, {'id': 10749, 'name': 'Romance'}]",,16388,tt0112585,en,The Brothers McMullen,"Deals with the lives of the three Irish Catholic McMullen brothers from Long Island, New York, over three months, as they grapple with basic ideas and values — love, sex, marriage, religion and family — in the 1990s. Directed, written, produced by and starring Edward Burns.",2.039196,/8YlwQ2BBH6PY3Tl0bOf0fLep31h.jpg,"[{'name': 'Fox Searchlight Pictures', 'id': 43}]","[{'iso_3166_1': 'US', 'name': 'United States of America'}]",1995-08-09,0,98.0,"[{'iso_639_1': 'en', 'name': 'English'}]",Released,Sometimes the Best Friends Are the Ones You've Known Your Whole Life.,The Brothers McMullen,False,6.3,23
False,"{'id': 14890, 'name': 'Bad Boys Collection', 'poster_path': '/tSVbihfvVTCbcm0zXKA7L8R6Y9v.jpg', 'backdrop_path': '/yUvBiiC77UY6SyKhfFyLj7DNbfh.jpg'}",19000000,"[{'id': 28, 'name': 'Action'}, {'id': 35, 'name': 'Comedy'}, {'id': 80, 'name': 'Crime'}, {'id': 53, 'name': 'Thriller'}]",,9737,tt0112442,en,Bad Boys,"Marcus Burnett is a hen-pecked family man. Mike Lowry is a foot-loose and fancy free ladies' man. Both are Miami policemen, and both have 72 hours to reclaim a consignment of drugs stolen from under their station's nose. To complicate matters, in order to get the assistance of the sole witness to a murder, they have to pretend to be each other.",9.262184,/1dKsSfpAqWSc5UJT9VIqK5JVFI5.jpg,"[{'name': 'Columbia Pictures', 'id': 5}, {'name': 'Don Simpson/Jerry Bruckheimer Films', 'id': 10288}]","[{'iso_3166_1': 'US', 'name': 'United States of America'}]",1995-04-07,141407024,118.0,"[{'iso_639_1': 'en', 'name': 'English'}]",Released,Whatcha gonna do?,Bad Boys,False,6.5,1729
False,,0,"[{'id': 28, 'name': 'Action'}, {'id': 12, 'name': 'Adventure'}, {'id': 18, 'name': 'Drama'}, {'id': 10751, 'name': 'Family'}]",,30765,tt0112342,en,The Amazing Panda Adventure,"Far from home in the lush bamboo forests of China, ten-year-old Ryan Tyler, with the help of a young girl, goes on a wonderful journey to rescue a baby panda taken by poachers.",2.375865,/1yB7ryvYqKrNTnWcx3C31RdUgL1.jpg,"[{'name': 'Warner Bros.', 'id': 6194}]","[{'iso_3166_1': 'US', 'name': 'United States of America'}]",1995-08-25,0,81.0,"[{'iso_639_1': 'de', 'name': 'Deutsch'}]",Released,"In the sweeping highlands of China, a boy begins a magical journey to save the life of a natural wonder.",The Amazing Panda Adventure,False,5.0,31
False,,0,"[{'id': 18, 'name': 'Drama'}, {'id': 80, 'name': 'Crime'}]",,10474,tt0112461,en,The Basketball Diaries,Film adaptation of street tough Jim Carroll's epistle about his kaleidoscopic free fall into the harrowing world of drug addiction.,7.415144,/8BkedYL5LdpkyHc7JtuohMr8a9N.jpg,"[{'name': 'New Line Cinema', 'id': 12}, {'name': 'Island Pictures', 'id': 3492}]","[{'iso_3166_1': 'US', 'name': 'United States of America'}]",1995-04-21,0,102.0,"[{'iso_639_1': 'en', 'name': 'English'}]",Released,The true story of the death of innocence and the birth of an artist.,The Basketball Diaries,False,7.2,472
False,,4000000,"[{'id': 10749, 'name': 'Romance'}, {'id': 18, 'name': 'Drama'}, {'id': 35, 'name': 'Comedy'}]",,22279,tt0112427,en,An Awfully Big Adventure,"An Awfully Big Adventure is a 1995 drama film about a theatre company in Liverpool, set in 1947 and based on the 1989 novel of the same name by Beryl Bainbridge.",0.922958,/e8YzXziAXKIqnWJbLI6OzbdkGYD.jpg,"[{'name': 'Fine Line Features', 'id': 8}, {'name': 'BBC', 'id': 5996}, {'name': 'British Screen Productions', 'id': 12745}, {'name': 'Portman Productions', 'id': 16027}]","[{'iso_3166_1': 'GB', 'name': 'United Kingdom'}]",1995-07-21,851545,113.0,"[{'iso_639_1': 'en', 'name': 'English'}]",Released,,An Awfully Big Adventure,False,6.0,11
False,,0,"[{'id': 80, 'name': 'Crime'}, {'id': 35, 'name': 'Comedy'}, {'id': 18, 'name': 'Drama'}, {'id': 53, 'name': 'Thriller'}]",,30157,tt0109093,en,Amateur,"A man wakes up in an alley, bleeding and with no memory of who he is. He stumbles into a coffee shop and is befriended by a charitable ex-nun who is failing in her attempts to write marketable pornography.",1.759012,/lZHBvDFavIfOx8gD4iqY701jF98.jpg,"[{'name': 'Channel Four Films', 'id': 181}, {'name': 'Zenith Entertainment', 'id': 3644}, {'name': 'American Playhouse', 'id': 3906}, {'name': 'Union Générale Cinématographique (UGC)', 'id': 7248}, {'name': 'La Sept Cinéma', 'id': 16366}, {'name': 'True Fiction Pictures', 'id': 37909}]","[{'iso_3166_1': 'FR', 'name': 'France'}, {'iso_3166_1': 'GB', 'name': 'United Kingdom'}, {'iso_3166_1': 'US', 'name': 'United States of America'}]",1994-08-05,0,105.0,"[{'iso_639_1': 'en', 'name': 'English'}]",Released,"Accountancy, Murder, Amnesia, Torture, Ecstasy, Understanding, Redemption",Amateur,False,6.5,21
False,,52000000,"[{'id': 18, 'name': 'Drama'}]",,568,tt0112384,en,Apollo 13,"The true story of technical troubles that scuttle the Apollo 13 lunar mission in 1971, risking the lives of astronaut Jim Lovell and his crew, with the failed journey turning into a thrilling saga of heroism. Drifting more than 200,000 miles from Earth, the astronauts work furiously with the ground crew to avert tragedy.",18.761467,/6JQ9z3V9x4vlU2GSZx2yNO0PvuX.jpg,"[{'name': 'Imagine Entertainment', 'id': 23}, {'name': 'Universal Pictures', 'id': 33}]","[{'iso_3166_1': 'US', 'name': 'United States of America'}]",1995-06-30,355237933,140.0,"[{'iso_639_1': 'en', 'name': 'English'}]",Released,"Houston, we have a problem.",Apollo 13,False,7.3,1637
False,,28000000,"[{'id': 12, 'name': 'Adventure'}]",,11780,tt0114287,en,Rob Roy,"In the highlands of Scotland in the 1700s, Rob Roy tries to lead his small town to a better future, by borrowing money from the local nobility to buy cattle to herd to market. When the money is stolen, Rob is forced into a Robin Hood lifestyle to defend his family and honour.",10.193549,/8O52wIIbskNl9kZnGvP9Gi4A2oN.jpg,"[{'name': 'United Artists', 'id': 60}, {'name': 'Talisman Productions', 'id': 8989}]","[{'iso_3166_1': 'GB', 'name': 'United Kingdom'}, {'iso_3166_1': 'US', 'name': 'United States of America'}]",1995-04-13,31596911,139.0,"[{'iso_639_1': 'en', 'name': 'English'}]",Released,Honor made him a man. Courage made him a hero. History made him a legend.,Rob Roy,False,6.5,151
False,,0,"[{'id': 18, 'name': 'Drama'}, {'id': 27, 'name': 'Horror'}]",,34996,tt0112288,en,The Addiction,A vampiric doctoral student tries to follow the philosophy of a nocturnal comrade and control her thirst for blood.,3.137285,/ej0gD547grj5QMoKuzqKyHuc3Xi.jpg,"[{'name': 'October Films', 'id': 236}, {'name': 'Guild', 'id': 1214}, {'name': 'Fastnet Films', 'id': 5353}]","[{'iso_3166_1': 'US', 'name': 'United States of America'}]",1995-01-10,0,82.0,"[{'iso_639_1': 'en', 'name': 'English'}]",Released,The dark is their sunlight. What makes them different is what keeps them alive.,The Addiction,False,6.4,46
False,"{'id': 120794, 'name': 'Batman Collection', 'poster_path': '/adQxUvQW8HXNsvMG5aj71pHh9T.jpg', 'backdrop_path': '/9SpZvXLZDGGtFqVDByGqSGI64Kw.jpg'}",100000000,"[{'id': 28, 'name': 'Action'}, {'id': 80, 'name': 'Crime'}, {'id': 14, 'name': 'Fantasy'}]",,414,tt0112462,en,Batman Forever,"The Dark Knight of Gotham City confronts a dastardly duo: Two-Face and the Riddler. Formerly District Attorney Harvey Dent, Two-Face believes Batman caused the courtroom accident which left him disfigured on one side. And Edward Nygma, computer-genius and former employee of millionaire Bruce Wayne, is out to get the philanthropist; as The Riddler. Former circus acrobat Dick Grayson, his family killed by Two-Face, becomes Wayne's ward and Batman's new partner Robin.",13.321354,/eTMrHEhlFPHNxpqGwpGGTdAa0xV.jpg,"[{'name': 'Warner Bros.', 'id': 6194}, {'name': 'Polygram Filmed Entertainment', 'id': 31080}]","[{'iso_3166_1': 'GB', 'name': 'United Kingdom'}, {'iso_3166_1': 'US', 'name': 'United States of America'}]",1995-06-16,336529144,121.0,"[{'iso_639_1': 'en', 'name': 'English'}]",Released,"Courage now, truth always...",Batman Forever,False,5.2,1529
False,,0,"[{'id': 18, 'name': 'Drama'}, {'id': 10749, 'name': 'Romance'}]",,649,tt0061395,fr,Belle de jour,"Beautiful young housewife Séverine Serizy cannot reconcile her masochistic fantasies with her everyday life alongside dutiful husband Pierre. When her lovestruck friend Henri mentions a secretive high-class brothel run by Madame Anais, Séverine begins to work there during the day under the name Belle de Jour. But when one of her clients grows possessive, she must try to go back to her normal life.",10.142662,/rHvKWARrhNwSjbTMJrn5v4LtUJE.jpg,"[{'name': 'Paris Films Productions', 'id': 386}, {'name': 'Five Films', 'id': 387}, {'name': 'Robert et Raymond Hakim', 'id': 11290}]","[{'iso_3166_1': 'FR', 'name': 'France'}, {'iso_3166_1': 'IT', 'name': 'Italy'}]",1967-05-24,0,101.0,"[{'iso_639_1': 'fr', 'name': 'Français'}, {'iso_639_1': 'mn', 'name': ''}, {'iso_639_1': 'es', 'name': 'Español'}]",Released,Luis Bunuel's Masterpiece of Erotica!,Belle de Jour,False,7.3,163
