adult,belongs_to_collection,budget,genres,homepage,id,imdb_id,original_language,original_title,overview,popularity,poster_path,production_companies,production_countries,release_date,revenue,runtime,spoken_languages,status,tagline,title,video,vote_average,vote_count
False,,0,"[{'id': 53, 'name': 'Thriller'}, {'id': 18, 'name': 'Drama'}, {'id': 9648, 'name': 'Mystery'}]",,99040,tt0112714,fr,Le confessionnal,"The year is 1952, in Quebec City. Rachel (16), unmarried and pregnant, works in the church. Filled with shame, she unburdens her guilt to a young priest, under the confidentiality of the confessional. In the present year of 1989, Pierre Lamontagne has returned to Quebec to attend his father's funeral. He meets up with his adopted brother, Marc, who has begun questioning his identity and has embarked on a quest for his roots that would lead them to the Quebec of the 1950s. Past and present converge in a complex web of intrigue where the answer to the mystery lies.",0.120789,/8RCRrSAY8e3Qn5p9cNv188ogmZQ.jpg,[],"[{'iso_3166_1': 'CA', 'name': 'Canada'}]",1995-09-29,0,100.0,"[{'iso_639_1': 'en', 'name': 'English'}, {'iso_639_1': 'fr', 'name': 'Français'}]",Released,,The Confessional,False,6.5,2
False,,45000000,"[{'id': 12, 'name': 'Adventure'}, {'id': 10751, 'name': 'Family'}, {'id': 14, 'name': 'Fantasy'}]",,11359,tt0113419,en,The Indian in the Cupboard,A nine-year-old boy gets a plastic Indian and a cupboard for his birthday and finds himself involved in adventure when the Indian comes to life and befriends him.,10.673296,/l16BtfILyWxYwSqzofL3V1rMSwe.jpg,"[{'name': 'Paramount Pictures', 'id': 4}, {'name': 'Columbia Pictures Corporation', 'id': 441}, {'name': 'The Kennedy/Marshall Company', 'id': 862}]","[{'iso_3166_1': 'US', 'name': 'United States of America'}]",1995-07-14,0,96.0,"[{'iso_639_1': 'en', 'name': 'English'}]",Released,,The Indian in the Cupboard,False,5.9,136
False,,20000000,"[{'id': 18, 'name': 'Drama'}, {'id': 53, 'name': 'Thriller'}]",,17182,tt0116260,en,Eye for an Eye,"It's fire and brimstone time as grieving mother Karen McCann takes justice into her own hands when a kangaroo court in Los Angeles fails to convict Robert Doob, the monster who raped and murdered her 17-year-old daughter.",4.733526,/y2lZSdJ1o0VvLegTw3ad6KFtxra.jpg,"[{'name': 'Paramount Pictures', 'id': 4}]","[{'iso_3166_1': 'US', 'name': 'United States of America'}]",1996-01-12,0,101.0,"[{'iso_639_1': 'en', 'name': 'English'}, {'iso_639_1': 'fr', 'name': 'Français'}, {'iso_639_1': 'ko', 'name': '한국어/조선말'}, {'iso_639_1': 'es', 'name': 'Español'}]",Released,What do you do when justice fails?,Eye for an Eye,False,5.8,65
False,,0,"[{'id': 10402, 'name': 'Music'}, {'id': 18, 'name': 'Drama'}, {'id': 10751, 'name': 'Family'}]",,2054,tt0113862,en,Mr. Holland's Opus,"In 1965, passionate musician Glenn Holland takes a day job as a high school music teacher, convinced it's just a small obstacle on the road to his true calling: writing a historic opus. As the decades roll by with the composition unwritten but generations of students inspired through his teaching, Holland must redefine his life's purpose.",7.137117,/jYEKdpVvRV3KdyHMUVYyg0KTVSY.jpg,"[{'name': 'Hollywood Pictures', 'id': 915}, {'name': 'The Charlie Mopic Company', 'id': 916}, {'name': 'PolyGram Filmed Entertainment', 'id': 1382}, {'name': 'Interscope Communications', 'id': 10201}]","[{'iso_3166_1': 'US', 'name': 'United States of America'}]",1995-12-29,106269971,137.0,"[{'iso_639_1': 'en', 'name': 'English'}]",Released,"Of All the Lives He Changed, the One That Changed the Most Was His Own.",Mr. Holland's Opus,False,6.9,115
False,,0,"[{'id': 35, 'name': 'Comedy'}]",,10607,tt0116126,en,Don't Be a Menace to South Central While Drinking Your Juice in the Hood,"When Ashtray (Shawn Wayans) moves to South Central L.A. to live with his father (who appears to be the same age he is) and grandmother (who likes to talk tough and smoke reefer), he falls in with his gang-banging cousin Loc Dog (Marlon Wayans), who along with the requisite pistols and Uzi carries a thermo-nuclear warhead for self-defense. Will Ashtray be able to keep living the straight life?",11.700115,/l6D9f9WbxdI4tyCmJGs56y8tQla.jpg,"[{'name': 'Miramax Films', 'id': 14}, {'name': 'Island Pictures', 'id': 3492}, {'name': 'Ivory Way Productions', 'id': 5441}]","[{'iso_3166_1': 'US', 'name': 'United States of America'}]",1996-01-12,0,89.0,"[{'iso_639_1': 'en', 'name': 'English'}, {'iso_639_1': 'es', 'name': 'Español'}]",Released,"Finally, the movie that proves that Justice isn't always Poetic, Jungle Fever isn't always pretty, and Higher Learning can be a waste of time.",Don't Be a Menace to South Central While Drinking Your Juice in the Hood,False,6.2,192
False,,0,"[{'id': 35, 'name': 'Comedy'}, {'id': 10749, 'name': 'Romance'}]",,19760,tt0118002,en,Two If by Sea,"Frank O'Brien, a petty thief, and his 7-year-long girlfriend Roz want to put an end to their unsteady lifestyle and just do that last job, which involves stealing a valuable painting. Frank takes Roz to an island on the coast of New England, where he wants to sell the painting and also hopes that their sagging relationship will get a positive push back up. Not everything goes as planned.",2.174487,/e0iwJJiLjk8Z6A9TuL3neX504H3.jpg,"[{'name': 'Warner Bros.', 'id': 6194}, {'name': 'Morgan Creek Productions', 'id': 10210}]","[{'iso_3166_1': 'US', 'name': 'United States of America'}]",1996-01-12,0,96.0,"[{'iso_639_1': 'en', 'name': 'English'}]",Released,"A new comedy about love, laughter, and larceny",Two If by Sea,False,4.5,14
False,,15000000,"[{'id': 35, 'name': 'Comedy'}]",,9536,tt0115683,en,Bio-Dome,"Bud and Doyle are two losers who are doing nothing with their lives. Both of their girlfriends are actively involved in saving the environment, but the two friends couldn't care less about saving the Earth. One day, when a group of scientists begin a mission to live inside a ""Bio-Dome"" for a year without outside contact, Bud and Doyle mistakenly become part of the project themselves.",6.387469,/1bAUaipv3gDU1pATGwziyq1VTwZ.jpg,"[{'name': 'Metro-Goldwyn-Mayer (MGM)', 'id': 8411}, {'name': 'Motion Picture Corporation of America (MPCA)', 'id': 11061}, {'name': '3 Arts Entertainment', 'id': 36390}, {'name': 'Weasel Productions', 'id': 38003}]","[{'iso_3166_1': 'US', 'name': 'United States of America'}]",1996-01-12,0,88.0,"[{'iso_639_1': 'en', 'name': 'English'}, {'iso_639_1': 'ru', 'name': 'Pусский'}]",Released,Bud and Doyle are here to save the world. But who's gonna save the world from Bud and Doyle?,Bio-Dome,False,4.4,110
False,"{'id': 124935, 'name': 'The Lawnmower Man Collection', 'poster_path': '/slBKrKBbL1g3KURphhAYIyOOH0G.jpg', 'backdrop_path': '/id05z92s8Pwc2wbR9YAKngGqOyP.jpg'}",0,"[{'id': 28, 'name': 'Action'}, {'id': 878, 'name': 'Science Fiction'}]",,11525,tt0116839,en,Lawnmower Man 2: Beyond Cyberspace,"Jobe is resuscitated by Jonathan Walker. He wants Jobe to create a special computer chip that would connect all the computers in the world into one network, which Walker would control and use. But what Walker doesn't realize is a group of teenage hackers are on to him and out to stop his plan.",2.49535,/i0hBsWBLw64XRehFzCL44PaCs1y.jpg,"[{'name': 'New Line Cinema', 'id': 12}]","[{'iso_3166_1': 'US', 'name': 'United States of America'}]",1996-01-12,2409225,92.0,"[{'iso_639_1': 'en', 'name': 'English'}, {'iso_639_1': 'hu', 'name': 'Magyar'}]",Released,"God made him simple. Science made him a god. Now, he wants revenge.",Lawnmower Man 2: Beyond Cyberspace,False,2.8,32
False,,0,"[{'id': 18, 'name': 'Drama'}, {'id': 10751, 'name': 'Family'}]",,40628,tt0114753,en,Two Bits,"It's a hot summer day in 1933 in South Philly, where 12-year old Gennaro lives with his widowed mom and his ailing grandpa, who sits outside holding tight to his last quarter, which he's promised to Gennaro and which Gennaro would like to have to buy a ticket to the plush new movie theater. But grandpa's not ready to pass on the quarter or pass on to his final reward: he has some unfinished business with a woman from his past, and he enlists Gennaro to act as his emissary.",4.046208,/k4jOFtt7NqEtLnoI2Rs3BqKNHtI.jpg,"[{'name': 'Miramax Films', 'id': 14}]","[{'iso_3166_1': 'US', 'name': 'United States of America'}]",1995-10-22,0,85.0,"[{'iso_639_1': 'en', 'name': 'English'}]",Released,You're never too old to believe in a dream. Or too young to make one come true!,Two Bits,False,5.4,11
False,,0,"[{'id': 35, 'name': 'Comedy'}, {'id': 10749, 'name': 'Romance'}]",,4482,tt0113149,fr,Gazon maudit,"After learning of her husband's infidelities, a housewife invites an itinerant lesbian to move in with them. None of their lives will ever be the same again.",2.518051,/dDB8mMKRL28gHsRcGPoMQYrzaXg.jpg,"[{'name': 'Renn Productions', 'id': 82}, {'name': 'Les Films Flam', 'id': 1614}, {'name': 'TF1 Films Production', 'id': 3823}, {'name': 'Canal+', 'id': 5358}]","[{'iso_3166_1': 'FR', 'name': 'France'}]",1995-02-08,0,95.0,"[{'iso_639_1': 'fr', 'name': 'Français'}, {'iso_639_1': 'es', 'name': 'Español'}]",Released,,French Twist,False,6.0,43
False,"{'id': 43563, 'name': 'Friday Collection', 'poster_path': '/dWh1Fohgx07AEd4vRUwgIj8BYxD.jpg', 'backdrop_path': '/pXszT8ZWGj3fohU9FY0niA0IDEw.jpg'}",3500000,"[{'id': 35, 'name': 'Comedy'}]",http://www.newline.com/properties/friday.html,10634,tt0113118,en,Friday,"Craig and Smokey are two guys in Los Angeles hanging out on their porch on a Friday afternoon, smoking and drinking, looking for something to do.",14.56965,/kkoGT4bnK5oGiNbzGGcXzrXMSxn.jpg,"[{'name': 'New Line Cinema', 'id': 12}]","[{'iso_3166_1': 'US', 'name': 'United States of America'}]",1995-04-26,28215918,91.0,"[{'iso_639_1': 'en', 'name': 'English'}]",Released,A lot can go down between thursday and saturday...,Friday,False,7.0,513
False,"{'id': 10924, 'name': 'From Dusk Till Dawn Collection', 'poster_path': '/a156nAy5ZTGXlO5wgfvnF26aaDB.jpg', 'backdrop_path': '/oIJQPVy33uxBAu9LMXwjsgHLyxP.jpg'}",19000000,"[{'id': 27, 'name': 'Horror'}, {'id': 28, 'name': 'Action'}, {'id': 53, 'name': 'Thriller'}, {'id': 80, 'name': 'Crime'}]",http://www.miramax.com/movie/from-dusk-till-dawn/,755,tt0116367,en,From Dusk Till Dawn,"Seth Gecko and his younger brother Richard are on the run after a bloody bank robbery in Texas. They escape across the border into Mexico and will be home-free the next morning, when they pay off the local kingpin. They just have to survive 'from dusk till dawn' at the rendezvous point, which turns out to be a Hell of a strip joint.",15.339153,/ce0d4kM5KxT4x1Oq8JkSuNYevri.jpg,"[{'name': 'A Band Apart', 'id': 59}, {'name': 'Dimension Films', 'id': 7405}, {'name': 'Los Hooligans Productions', 'id': 11705}, {'name': 'Miramax', 'id': 53009}]","[{'iso_3166_1': 'US', 'name': 'United States of America'}]",1996-01-19,25836616,108.0,"[{'iso_639_1': 'en', 'name': 'English'}, {'iso_639_1': 'es', 'name': 'Español'}]",Released,One night is all that stands between them and freedom. But it's going to be a hell of a night.,From Dusk Till Dawn,False,6.9,1644
False,,50000000,"[{'id': 28, 'name': 'Action'}, {'id': 53, 'name': 'Thriller'}, {'id': 10749, 'name': 'Romance'}]",,11859,tt0113010,en,Fair Game,"Max Kirkpatrick is a cop who protects Kate McQuean, a civil law attorney, from a renegade KGB team out to terminate her",5.912223,/ew0LrIN5fpxdimrErEy9Yry3Nn2.jpg,"[{'name': 'Silver Pictures', 'id': 1885}, {'name': 'Warner Bros.', 'id': 6194}]","[{'iso_3166_1': 'US', 'name': 'United States of America'}]",1995-11-03,11534477,91.0,"[{'iso_639_1': 'en', 'name': 'English'}, {'iso_639_1': 'es', 'name': 'Español'}]",Released,He's a cop on the edge. She's a woman with a dangerous secret. And now they're both...,Fair Game,False,4.1,54
False,,0,"[{'id': 35, 'name': 'Comedy'}, {'id': 18, 'name': 'Drama'}, {'id': 10749, 'name': 'Romance'}]",,28387,tt0113537,en,Kicking and Screaming,"After college graduation, Grover's girlfriend Jane tells him she's moving to Prague to study writing. Grover declines to accompany her, deciding instead to move in with several friends, all of whom can't quite work up the inertia to escape their university's pull. Nobody wants to make any big decisions that would radically alter his life, yet none of them wants to end up like Chet, the professional student who tends bar and is in his tenth year of university studies.",3.367276,/urPxxjylNUHmoNcGkMgHStMTxhF.jpg,"[{'name': 'Castleberg Productions', 'id': 5841}, {'name': 'Sandollar Productions', 'id': 5842}]","[{'iso_3166_1': 'US', 'name': 'United States of America'}]",1995-10-06,718490,96.0,"[{'iso_639_1': 'en', 'name': 'English'}]",Released,Anxiety loves company.,Kicking and Screaming,False,7.0,36
False,,0,"[{'id': 18, 'name': 'Drama'}, {'id': 36, 'name': 'History'}]",,48750,tt0113828,fr,Les misérables,"In France during World War II, a poor and illiterate man, Henri Fortin (Jean-Paul Belmondo), is introduced to Victor Hugo's classic novel Les Misérables and begins to see parallels between the book and his own life.",1.479446,/ePJCk8puXx28CtvpSpmezpwfVt8.jpg,"[{'name': 'Les Films 13', 'id': 1742}, {'name': 'Canal+', 'id': 5358}, {'name': 'TF1', 'id': 22123}]","[{'iso_3166_1': 'FR', 'name': 'France'}]",1995-03-22,0,175.0,"[{'iso_639_1': 'fr', 'name': 'Français'}]",Released,"In a time of chaos, in a world of change, he was moved by a book he could not read to become a hero he never imagined.",Les Miserables,False,6.6,8
False,,0,"[{'id': 18, 'name': 'Drama'}, {'id': 10749, 'name': 'Romance'}]",,20927,tt0115644,en,Bed of Roses,"The seeds of love are planted when Lisa, a high-powered investment banker, receives flowers from a secret admirer. But when his fairy-tale fantasies clash with her workaholic ways, they soon find out that sometimes, it's harder than it seems for love to conquer all.",10.412194,/kTEpzjzyeYER1WuCm7Seul4Fatc.jpg,"[{'name': 'New Line Cinema', 'id': 12}, {'name': 'Juno Pix', 'id': 4286}]","[{'iso_3166_1': 'US', 'name': 'United States of America'}]",1996-01-26,19030691,87.0,"[{'iso_639_1': 'en', 'name': 'English'}]",Released,He gave her flowers. She gave him a chance.,Bed of Roses,False,5.1,27
False,,15000000,"[{'id': 35, 'name': 'Comedy'}, {'id': 10751, 'name': 'Family'}]",,36929,tt0115676,en,Big Bully,"A writer returns to his hometown where he faces the childhood nemesis whose life he ultimately ruined, only the bully wants to relive their painful past by torturing him once again.",2.936443,/wtFekK9VKWujQW9R9c6sYbir6wm.jpg,"[{'name': 'Warner Bros.', 'id': 6194}, {'name': 'Morgan Creek Productions', 'id': 10210}]","[{'iso_3166_1': 'US', 'name': 'United States of America'}]",1996-01-26,2042530,90.0,"[{'iso_639_1': 'en', 'name': 'English'}]",Released,A comedy for the kid in all of us.,Big Bully,False,3.9,16
False,"{'id': 122017, 'name': 'Screamers Collection', 'poster_path': '/vtCuIaQvK3IyLENmuc73RFm4TU7.jpg', 'backdrop_path': None}",20000000,"[{'id': 27, 'name': 'Horror'}, {'id': 878, 'name': 'Science Fiction'}]",,9102,tt0114367,en,Screamers,"(SIRIUS 6B, Year 2078) On a distant mining planet ravaged by a decade of war, scientists have created the perfect weapon: a blade-wielding, self-replicating race of killing devices known as Screamers designed for one purpose only -- to hunt down and destroy all enemy life forms.",12.758848,/aFEs7D7IQ2IehTsniRIojDkiDl6.jpg,"[{'name': 'The Movie Network (TMN)', 'id': 3388}, {'name': 'Allegro Films', 'id': 4899}, {'name': 'Fuji Eight Company Ltd.', 'id': 7958}, {'name': 'Fries Film Group', 'id': 23096}, {'name': 'Super Ecran', 'id': 23097}, {'name': 'Triumph Films', 'id': 23098}]","[{'iso_3166_1': 'CA', 'name': 'Canada'}, {'iso_3166_1': 'JP', 'name': 'Japan'}, {'iso_3166_1': 'US', 'name': 'United States of America'}]",1995-09-08,5781885,108.0,"[{'iso_639_1': 'en', 'name': 'English'}]",Released,The last scream you hear will be your own.,Screamers,False,6.1,154
False,,0,"[{'id': 99, 'name': 'Documentary'}]",,124626,tt0113973,en,Nico Icon,"A look into the many lives of Christa Päffgen, otherwise known as Nico; from cutie German mädchen to the first of the supermodels, to glamorous diva of the Velvet Underground, to cult item, junkie and hag. Many faces for the same woman, whom, you realize, just couldn't bring herself to care enough to live.",0.133893,/tuIDKBp92R4tGFOB46MofvakfiY.jpg,"[{'name': 'Zweites Deutsches Fernsehen (ZDF)', 'id': 4606}, {'name': 'Ciak Filmproduktion', 'id': 83201}, {'name': 'Bluehorse Films', 'id': 93174}]","[{'iso_3166_1': 'DE', 'name': 'Germany'}, {'iso_3166_1': 'US', 'name': 'United States of America'}]",1995-02-18,0,70.0,"[{'iso_639_1': 'de', 'name': 'Deutsch'}, {'iso_639_1': 'en', 'name': 'English'}]",Released,,Nico Icon,False,7.3,3
False,,0,"[{'id': 18, 'name': 'Drama'}, {'id': 53, 'name': 'Thriller'}]",,27526,tt0112744,en,The Crossing Guard,"After his daughter died in a hit and run, Freddy Gale has waited six years for John Booth, the man responsible, to be released from prison. On the day of release, Gale visits Booth and announces that he will kill him in one week. Booth uses his time to try and make peace with himself and his entourage, and even finds romance. Gale, whose life is spiraling down because of his obsession towards Booth, will bring himself on the very edge of sanity. At he end of the week, both men will find themselves on a collision course with each other.",5.756462,/mMXL84GqES2HYpJ0Zt18I7m6mfU.jpg,"[{'name': 'Miramax Films', 'id': 14}]","[{'iso_3166_1': 'US', 'name': 'United States of America'}]",1995-11-15,0,111.0,"[{'iso_639_1': 'en', 'name': 'English'}]",Released,"...some lives cross, others collide.",The Crossing Guard,False,6.1,74
False,,44000000,"[{'id': 18, 'name': 'Drama'}, {'id': 53, 'name': 'Thriller'}]",,9623,tt0116731,en,The Juror,"With his gangster boss on trial for murder, a mob thug known as ""the Teacher"" tells Annie Laird she must talk her fellow jurors into a not-guilty verdict, implying that he'll kill her son Oliver if she fails. She manages to do this, but, when it becomes clear that the mobsters might want to silence her for good, she sends Oliver abroad and tries to gather evidence of the plot against her, setting up a final showdown.",6.010579,/7aXOB0DyZPxNOYbaQ2oiNn64jm3.jpg,"[{'name': 'Columbia Pictures Corporation', 'id': 441}]","[{'iso_3166_1': 'US', 'name': 'United States of America'}]",1996-02-02,0,118.0,"[{'iso_639_1': 'en', 'name': 'English'}]",Released,There is no defense.,The Juror,False,5.5,91
False,,0,"[{'id': 10751, 'name': 'Family'}, {'id': 18, 'name': 'Drama'}]",,46785,tt0112445,fa,بادکنک سفید,Several people try to take advantage of a little girl's innocence to hustle money her mom gave to her to buy a goldfish with.,1.196256,/96UDOJNgJXHmQMJqA79bKS9PR8i.jpg,"[{'name': 'I.R.I.B. Channel 2', 'id': 38953}, {'name': 'Ferdos Films', 'id': 38954}]","[{'iso_3166_1': 'IR', 'name': 'Iran'}]",1995-01-01,0,85.0,"[{'iso_639_1': 'fa', 'name': 'فارسی'}]",Released,,The White Balloon,False,7.5,20
False,,8000000,"[{'id': 18, 'name': 'Drama'}, {'id': 80, 'name': 'Crime'}]",,400,tt0114660,en,Things to Do in Denver When You're Dead,A mafia film in Tarantino style with a star-studded cast. Jimmy’s “The Saint” gangster career has finally ended. Yet now he finds him self doing favors for a wise godfather known as “The Man with the Plan.”,4.486179,/ysKIolKO0376Nl5DV1fDAAPudEq.jpg,"[{'name': 'Miramax Films', 'id': 14}]","[{'iso_3166_1': 'US', 'name': 'United States of America'}]",1995-12-01,529766,116.0,"[{'iso_639_1': 'en', 'name': 'English'}]",Released,Protect. Love. Honor. Avenge.,Things to Do in Denver When You're Dead,False,6.7,87
False,,900000,"[{'id': 18, 'name': 'Drama'}, {'id': 35, 'name': 'Comedy'}]",,880,tt0112379,nl,Antonia,"After World War II, Antonia and her daughter, Danielle, go back to their Dutch hometown, where Antonia's late mother has bestowed a small farm upon her. There, Antonia settles down and joins a tightly-knit but unusual community. Those around her include quirky friend Crooked Finger, would-be suitor Bas and, eventually for Antonia, a granddaughter and great-granddaughter who help create a strong family of empowered women.",2.030174,/bIQp2SJrVXiQttv9hXeqliQox0K.jpg,"[{'name': 'Bergen Film', 'id': 575}, {'name': 'Bard Entertainments', 'id': 576}, {'name': 'NPS Televisie', 'id': 577}]","[{'iso_3166_1': 'NL', 'name': 'Netherlands'}, {'iso_3166_1': 'GB', 'name': 'United Kingdom'}, {'iso_3166_1': 'BE', 'name': 'Belgium'}]",1995-09-12,0,102.0,"[{'iso_639_1': 'nl', 'name': 'Nederlands'}]",Released,A motion picture that celebrates everything you love about life.,Antonia's Line,False,7.2,26
False,,0,"[{'id': 10749, 'name': 'Romance'}, {'id': 18, 'name': 'Drama'}]",,146599,tt0114039,en,Once Upon a Time... When We Were Colored,"This film relates the story of a tightly connected Afro-American community informally called Colored Town where the inhabitants live and depend on each other in a world where racist oppression is everywhere, as told by a boy called Cliff who spent his childhood there. Despite this, we see the life of the community in all its joys and sorrows, of those that live there while others decide to leave for a better life north. For those remaining, things come to a serious situation when one prominent businessman is being muscled out by a white competitor using racist intimidation. In response, the community must make the decision of whether to submit meekly like they always have, or finally fight for their rights.",0.252287,/tsJSlkFSZPQhhVuKrYJXNClYaPD.jpg,"[{'name': 'BET Pictures', 'id': 38196}, {'name': 'United Image Entertainme', 'id': 38197}]","[{'iso_3166_1': 'US', 'name': 'United States of America'}]",1996-01-26,0,115.0,"[{'iso_639_1': 'en', 'name': 'English'}]",Released,,Once Upon a Time... When We Were Colored,False,4.5,2
False,,0,[],,188588,tt0113612,en,Last Summer in the Hamptons,"Filmed entirely on location in East Hampton, Long Island, ""Last Summer in the Hamptons"" concerns a large theatrical family spending the last weekend of their summer together at the decades-old family retreat which economic circumstances have forced them to put on the market. Victoria Foyt plays a young Hollywood actress whose visit wreaks havoc on the stellar group of family and friends - led by matriarch Viveca Lindfors and made up of an extraordinary mix of prominent New York actors, directors, and playwrights. In the course of a very unusual weekend, comic as well as serious situations arise, and the family's secrets - of which there are many - begin to unravel.",0.531159,/pfgpkDNcwSi1x4jVzeLqvxTwX5a.jpg,[],[],1995-11-22,0,108.0,[],Released,,Last Summer in the Hamptons,False,0.0,0
False,,0,"[{'id': 18, 'name': 'Drama'}, {'id': 10749, 'name': 'Romance'}]",,8447,tt0112365,en,Angels and Insects,"In Victorian England, wealthy patriarch Sir Harald Alabaster invites an impoverished biologist, William Adamson, into his home. There, William tries to continue his work, but is distracted by Alabaster's seductive daughter, Eugenia. William and Eugenia begin a torrid romance, but as the couple become closer, the young scientist begins to realize that dark, disturbing things are happening behind the closed doors of the Alabaster manor.",2.15166,/1QyCF6IFoX5WJIYHOkmLa3vzU0r.jpg,"[{'name': 'Playhouse International Pictures', 'id': 2492}, {'name': 'The Samuel Goldwyn Company', 'id': 8888}]","[{'iso_3166_1': 'GB', 'name': 'United Kingdom'}, {'iso_3166_1': 'US', 'name': 'United States of America'}]",1995-09-10,0,118.0,"[{'iso_639_1': 'en', 'name': 'English'}]",Released,An elegant seduction. An erotic deception. A stunning revelation.,Angels and Insects,False,6.3,17
False,,38000000,"[{'id': 28, 'name': 'Action'}, {'id': 18, 'name': 'Drama'}]",,10534,tt0118158,en,White Squall,Teenage boys discover discipline and camaraderie on an ill-fated sailing voyage.,9.568604,/3a5nomeyzJF4gG26HouCtce99ki.jpg,"[{'name': 'Hollywood Pictures', 'id': 915}, {'name': 'Largo Entertainment', 'id': 1644}, {'name': 'Scott Free Productions', 'id': 1645}]","[{'iso_3166_1': 'US', 'name': 'United States of America'}]",1996-02-02,10300000,129.0,"[{'iso_639_1': 'da', 'name': 'Dansk'}, {'iso_639_1': 'en', 'name': 'English'}, {'iso_639_1': 'fr', 'name': 'Français'}, {'iso_639_1': 'de', 'name': 'Deutsch'}]",Released,,White Squall,False,6.3,86
False,,16000000,"[{'id': 12, 'name': 'Adventure'}, {'id': 35, 'name': 'Comedy'}, {'id': 10751, 'name': 'Family'}]",,17414,tt0116151,en,Dunston Checks In,"Hotel manager Robert Grant is forced by his boss to postpone his family vacation when a hotel critic checks in. Trouble is, the critic is really a villainous jewel thief with an orangutan assistant named Dunston. When Dunston gets loose and tries to escape a life of crime -- aided by Robert's sons -- havoc, hijinks and lots of laughs abound!",4.814825,/lXSWbUA3T2o792SYdbfFKFTcSC1.jpg,"[{'name': 'Twentieth Century Fox Film Corporation', 'id': 306}, {'name': 'Joe Wizan/Todd Black', 'id': 3311}]","[{'iso_3166_1': 'US', 'name': 'United States of America'}]",1996-01-12,0,88.0,"[{'iso_639_1': 'en', 'name': 'English'}, {'iso_639_1': 'fr', 'name': 'Français'}, {'iso_639_1': 'ru', 'name': 'Pусский'}]",Released,He's about to turn a Five Star Hotel into a three ring circus.,Dunston Checks In,False,5.1,59
False,,0,"[{'id': 35, 'name': 'Comedy'}]",,13997,tt0115697,en,Black Sheep,"When dignified Albert Donnelly runs for Governor, his team moves to keep his slow-witted and klutzy younger brother, Mike, out of the eye of the media. To baby-sit Mike, the campaign assigns sarcastic Steve, who gets the experience of a lifetime when he tries to take Mike out of town during the election.",8.963037,/2wsaboVhKXpsLchoaXi0oWmQ7xM.jpg,"[{'name': 'Paramount Pictures', 'id': 4}]","[{'iso_3166_1': 'US', 'name': 'United States of America'}]",1996-02-01,32,87.0,"[{'iso_639_1': 'en', 'name': 'English'}]",Released,There's one in every family.,Black Sheep,False,6.0,124
